{
  "chapter_index": 4,
  "chapter_title": "报表说稳定，仓库在冒烟",
  "opening_state": "陆川刚被推上临时董事长位置不久，在总部会议或汇报场景中面对一堆看似平稳的运营数据。韩啸等管理层试图用报表、术语和流程话术把局面描述成“局部波动、总体可控”，并默认陆川只是个不懂管理的临时摆设。陆川虽然听不惯这些黑话，但已经敏锐察觉到报表和真实履约之间有问题，尤其怀疑站点与分拨端的异常被故意淡化。苏蔓此时仍偏观察者立场，主要负责程序和记录，尚未完全站到陆川一边。",
  "ending_state": "陆川不顾阻拦亲自到核心分拨现场，拿到仓内爆仓、错分、延迟、骑手空跑与调度失真的第一手证据，确认问题根源并非单纯“骑手不够”，而是调度系统为了做出好看数据，把近单拆远、强行均衡，导致履约效率雪崩。一线员工和站点人员第一次明显感到他不是来摆拍作秀的领导。苏蔓开始主动以制度和证据视角记录异常。陆川初步建立起“他真懂现场”的可信度，但同时也看见问题比想象中更深，且背后可能有人明知不对仍不回退策略。",
  "protagonist_goal": "弄清公司到底烂在什么地方，证明危机不在会议室话术里，而在现场履约链条已经失真；同时拿到足够硬的现场事实，避免自己继续被当成只会背锅的临时招牌。",
  "obstacle": "韩啸及总部管理层不希望陆川直接去现场，担心真实情况暴露后影响他们既有说法和责任切割，因此会用程序、风险、接待安排、现场可能失控等理由拖延或阻止。现场本身也处于高压混乱状态，人员烦躁、订单堆积、信息不透明，陆川即使到了也不可能靠一句话就理顺全局，只能先从观察、追问和比对单据中抓问题。",
  "required_information": [
    "必须明确总部汇报口径与真实现场状况存在巨大落差，形成章节核心反差。",
    "必须出现陆川对高管黑话和漂亮数据的不耐烦，但这种不耐烦要落到具体履约疑点上，而不是空喊反感管理。",
    "必须写出陆川坚持去现场的主动动作，体现他从口头质疑转为实地验证。",
    "必须出现核心分拨点或仓库的具象混乱：爆仓、错分、积压、线路车等待、骑手抱怨、客服压力或商户催单中的至少数项。",
    "必须揭示问题表面像运力不足，实则是调度系统把近单拆远、追求均衡和报表好看，造成无效路程暴增。",
    "必须让陆川通过一线经验看出问题，不靠神奇技术能力，不靠突然精通后台算法。",
    "必须让苏蔓在现场看到陆川判断的有效性，并开始主动记录异常、保存证据，为后续制度博弈做铺垫。",
    "必须让一线员工或站点人员对陆川态度发生细微转变，从防备、看笑话或冷漠，转向愿意多说两句真话。",
    "必须埋下“系统不是天然坏，是被改坏或被人为坚持错误策略”的方向，但此章不要直接锁定具体内鬼。",
    "必须以现场单据、调度单或派送轨迹作为硬证据落点，为章末钩子服务。"
  ],
  "avoid_conflicts": [
    "不能把陆川写成一到现场就自动掌控全局的霸总，他此时仍是被迫上位、靠经验判断的人。",
    "不能让问题被简单归结为某个员工偷懒或骑手不够，必须保持系统性管理失真的根因。",
    "不能让韩啸降智成纯小丑，他应体现出老练的控场和遮掩能力，只是被现实打脸。",
    "不能让苏蔓突然无条件站队，她应是基于观察陆川有效性后开始更积极配合。",
    "不能让陆川突然精通技术后台或算法细节，他应通过路线常识、单据异常和现场反馈看出调度逻辑不对，再为后续技术线铺路。",
    "不能出现靠发火、拍桌子就解决仓内问题的桥段，本章重点是发现真相与初步止血意识，不是彻底解决。",
    "不能把一线员工写成单纯起哄背景板，他们要有真实抱怨、利益压力和对总部的不信任。",
    "不能与前期人物定位冲突：陆川依旧最在意送达率、赔付和兄弟们别白跑白赔。",
    "不能过早揭穿内鬼或资本阴谋，本章只做到发现调度与履约现实严重背离。",
    "不能让章节停留在会议室嘴仗，必须有现场场景并由现场完成第一次可信度建立。"
  ],
  "emotion_curve": [
    "憋屈：陆川面对总部稳定报表和黑话包装，强烈感觉不对却暂时拿不出证据。",
    "烦躁：韩啸等人试图用流程和理由拦住他下现场，让他更确定这里面有猫腻。",
    "冲动破局：陆川决定不再听汇报，直接去分拨点看真实情况。",
    "震惊：现场混乱程度远超预期，爆仓、错分、延迟和空跑同时出现。",
    "愤怒：陆川意识到这不是普通忙乱，而是有人拿一线和商户成本去换报表体面。",
    "专注：情绪从发火转入判断，开始顺着单据、轨迹和现场反馈抓核心问题。",
    "初步提气：一线人员发现他问的问题都问在点上，愿意配合，陆川第一次在公司内部建立一点真实分量。",
    "压着火的清醒：他确认问题能救，但必须先止血，而且背后麻烦才刚开始。"
  ],
  "cliffhanger": "陆川在后台打印出的调度单和派送轨迹里，看到同一区域订单被刻意绕远、近单派给远端骑手的离谱记录，几乎可以直接证明系统策略在主动制造低效；他盯着那张单子，意识到这不是偶然错单，而是有人一直在用错误规则运行全网。",
  "next_chapter_bridge": "下一章应紧接陆川拿着轨迹单据和现场证据回到管理层或直接留在现场，开始追问是谁坚持这套调度策略、为什么不回退，并尝试做第一轮临时止血动作；同时引出技术侧角色对系统被改坏的补充解释。"
}