{
  "chapter_index": 15,
  "chapter_title": "先卸他的椅子",
  "opening_state": "陆川刚凭前阶段对站点、调度和履约的止血动作，拿到局部威信，但位置并不稳。董事会内部已从单纯看笑话转为认真评估他是否值得留下。韩啸抓住近期制度调整、异常成本和外部舆情抬头的机会，准备在正式场合把陆川定义成“外行乱改、放大风险”的责任人。苏蔓已经察觉这不再是普通甩锅，而是一次试图把陆川彻底从位置上卸下来的程序性围剿。",
  "ending_state": "陆川没有被当场赶下台，但被董事会明确压上最后观察期限，职位进入最危险阶段。魏岚没有完全站队韩啸，而是冷处理地给了陆川一个极短的证明窗口：如果他不能证明修复履约比拆卖资产更有价值，就会被替换。苏蔓进一步点醒陆川，接下来不能再只靠救火成绩说话，必须抓到是谁在制造这些火。就在这时，郑维负责区域爆出大面积错派和骑手事故，新的舆情全面反噬到陆川头上。",
  "protagonist_goal": "陆川本章的核心目标不是赢得漂亮，而是保住位置、顶住董事会问责，争取到继续查问题和证明价值的时间窗口，避免自己被当成近期所有动荡的总责任人直接清出局。",
  "obstacle": "阻碍来自多重夹击：韩啸联合止损派把舆情、成本异常、试点风险包装成一套完整问责逻辑；陆川虽然有站点和商户端的真实改善成绩，却缺少足以在董事会层面一锤定音的证据；他不擅长高层话术和制度攻防，容易在规则场上吃亏；更关键的是，真正制造异常的人还藏在内部，导致陆川始终只能被动解释结果，无法主动定义问题。",
  "required_information": [
    "必须交代本章主要战场是董事会或高层问责场景，核心不是现场救火，而是话语权与责任归属之争。",
    "必须明确韩啸的攻击点：把近期动荡归因于陆川的制度调整、现场试点和外行干预，试图形成“他带来更大不确定性”的叙事。",
    "必须呈现陆川并非毫无反击，他能拿出站点止血、商户反馈、履约改善等真实一线成果，但这些成果不足以完全压过资本和制度层面的怀疑。",
    "必须揭示魏岚的真实姿态：她不是简单替韩啸站台，也不是突然支持陆川，而是从止损与价值判断角度观察，核心关心的是修复履约是否比拆卖资产更值钱。",
    "必须让苏蔓在本章承担关键提醒作用，明确告诉陆川：只证明自己救过火还不够，必须找到是谁在反复制造事故、放大风险。",
    "必须让陆川第一次真切感到自己可能会被正式赶出董事长位置，这种危机感要比前面章节更实、更近。",
    "必须体现董事会正式给出最后期限或观察窗口，形成制度化压力，而不是口头警告。",
    "必须埋下郑维区域异常并非单纯管理失误的怀疑，为后续从结果追查到内鬼轨迹做承接。",
    "必须让结尾的大面积错派与骑手事故来得足够突然且恶化舆情，使陆川刚争来的窗口立刻被压缩，形成连续危机。"
  ],
  "avoid_conflicts": [
    "不要把陆川写成突然精通董事会博弈、法律或资本估值，他在会议场上应仍有短板，主要靠真实业务理解和苏蔓补位。",
    "不要让董事会成员集体降智，韩啸和魏岚的发难都应有现实逻辑：成本、风险、舆情、资产价值判断都要成立。",
    "不要让魏岚直接洗白成盟友，她此阶段仍以止损和价值最大化为优先，只是暂不拍死陆川。",
    "不要让陆川靠情绪爆发或一句狠话反败为胜，本章重点是他被逼到边缘而非强行赢麻。",
    "不要吃掉前文建立的成果，站点止血和系统修补应确实产生过局部成效，只是这些成效暂时不足以对冲新的问责压力。",
    "不要把危机完全写成阴谋，本章应保持系统性烂法、管理失真与人为放大并存的结构。",
    "不要让郑维直接在本章暴露身份或证据坐实，现阶段只能通过异常结果和违和感埋线。",
    "不要偏离主角核心价值观，陆川在被问责时仍应最在意履约、赔付、公平和一线兄弟是否被拿去垫背。"
  ],
  "emotion_curve": [
    "短暂绷紧：陆川意识到这次会议不是普通汇报，而是冲着卸椅子来的。",
    "强压憋屈：韩啸用制度和数据叙事压人，陆川明知很多锅不该自己背，却一时拿不出决定性证据。",
    "局部反顶：陆川用一线事实、商户和站点结果硬生生顶住一轮，不让自己被当场定死。",
    "冷水浇头：魏岚不给情绪，只给价值判断和最后窗口，让陆川明白自己还远没赢。",
    "真实失重：会后陆川第一次清楚感到，自己可能真的很快就不再坐这个位置。",
    "被迫转向：苏蔓提醒他问题已不是会不会救火，而是谁在放火，促使他思路升级。",
    "骤然下坠：郑维区域突发大面积错派和骑手事故，舆情反噬升级，把陆川再次推向更深危机。"
  ],
  "cliffhanger": "董事会刚给出最后观察期限，会后消息立刻炸开：郑维负责区域出现大面积错派、骑手连环事故和用户投诉，外部舆论迅速把责任全挂到“临时董事长陆川乱改制度”头上，陆川刚保住的椅子瞬间又悬了起来。",
  "next_chapter_bridge": "下一章直接承接这场事故危机：陆川必须第一时间下沉事故区域，先止住履约和人员风险，同时从错派路径、调度痕迹、赔付流向和现场反馈里找出异常源头，正式从被动挨打转入追查‘谁在制造结果’。"
}