{
  "chapter_index": 13,
  "chapter_title": "高价挖人，挖的是信心",
  "opening_state": "陆川靠前期站点止血和调度修补，刚让老周站点恢复表面稳定，但公司整体仍处在风声鹤唳阶段。闪奔到家趁迅城达口碑未稳、系统问题余波未平，开出签约金、保底单量和更轻罚款规则，高调挖骑手和站长。老周站点内部开始出现观望、私聊、试探离职，大家不是单纯想多赚一笔，而是担心迅城达随时会垮，留下来最后连账都结不清。",
  "ending_state": "陆川没有靠空口承诺或情绪绑架，而是在站点公开承认公司确实有问题，同时给出可落地的稳人方案和时间表，暂时稳住一批核心骑手与老周站点的骨干。老周由原本配合，进一步转为主动替陆川压阵、做内部说服。陆川也更清楚地意识到，自己现在要修的不只是调度和履约，而是整个市场、站点和骑手对‘迅城达到底还能不能活’的信念。章末，新的更危险迹象出现：商户侧数据疑似泄露，说明问题已不只是挖人，而可能有内部信息外流。",
  "protagonist_goal": "稳住老周站点和核心骑手，阻止闪奔到家通过高价挖角击穿迅城达的人心，并证明留下来不是讲义气，而是更稳、更可持续的现实选择。",
  "obstacle": "陆川手里没有足够资金跟竞争对手打补贴战，也不能虚构未来忽悠一线；公司过去拖欠、罚款、系统失灵造成的历史伤痕真实存在，骑手和站长对总部天然不信任。与此同时，外部竞争对手集中制造‘迅城达要倒闭’的市场叙事，内部中高层未必真心配合，陆川必须在资源不足、信任不足、时间紧迫的情况下稳住局面。",
  "required_information": [
    "必须明确闪奔到家的挖角方式不是简单发传单，而是有组织地针对站长、骨干骑手分别开条件，体现竞争专业性。",
    "必须点出高签约金和保底单量看似诱人，但真正撬动人心的核心不是钱本身，而是‘迅城达会不会倒’的恐慌。",
    "必须呈现老周站点内部的真实分化：有人想走、有人观望、有人讲现实、有人念旧情，不能把基层写成铁板一块。",
    "必须让陆川正面承认公司确实有烂账、有系统问题、有管理层失真，体现他开始学会不粉饰太平。",
    "必须体现陆川的解决方式依旧基于一线逻辑：算收益稳定性、算罚款风险、算接单密度、算长期可持续，而不是只喊口号。",
    "必须安排老周在关键时刻表态，但他的支持要建立在陆川前期做过实事的基础上，不是无条件站队。",
    "必须让苏蔓或其他制度侧角色提供有限辅助，例如把陆川的人话方案整理成可执行承诺或风险边界，但不能喧宾夺主。",
    "必须释放新信息：市场叙事已经成为和系统漏洞同等级的致命问题，陆川开始意识到治理范围扩大了。",
    "必须在结尾引出赵姐反馈：竞争对手掌握了她门店的详细配送数据，疑似内部资料泄露，为下一章的信息外流线埋钩。",
    "必须保持轻喜剧与现实压迫并存，可通过陆川在站点讲话、拆补贴话术时形成反差和讽刺感，但情绪底色不能轻飘。"
  ],
  "avoid_conflicts": [
    "不要让陆川突然有大笔资金跟补贴，不能靠撒钱反杀竞争对手。",
    "不要把骑手写成只认钱的工具人，必须保留他们对结算、规则、公平、平台生死的真实判断。",
    "不要让老周无缘无故死忠，必须延续其一线老站长谨慎、先看结果再表态的人设。",
    "不要让高管或竞争对手集体降智，闪奔到家的挖角策略应当现实有效。",
    "不要让陆川突然擅长资本、公关或法律全套技能，他依旧应靠现场判断，制度表达可由苏蔓补位。",
    "不要写成一场讲话就全员热血回归，结果应是暂时稳住核心、缓住流失，而非彻底解决。",
    "不要否定前期治理成果，本章应体现前期止血有效但还不够，属于问题升级而非重复原地踏步。",
    "不要脱离行业逻辑，必须围绕骑手收益、单量密度、罚款机制、站点稳定性和商户信任展开。",
    "不要把公司危机纯写成外部阴谋，仍要保留迅城达自身管理失真导致人心脆弱的根本原因。",
    "不要提前彻底坐实内鬼身份，本章只可加强信息外泄的疑点，不宜过早揭晓真相。"
  ],
  "emotion_curve": [
    "表面稳住后的短暂喘息",
    "挖角消息扩散带来的焦虑和失控感",
    "看到人心浮动后的无力与憋屈",
    "陆川选择不装、不骗后的沉重转折",
    "用现实账和担当换回部分信任的回暖",
    "老周出面压阵带来的局部稳住",
    "刚稳住站点又发现商户数据泄露的再度绷紧"
  ],
  "cliffhanger": "章末赵姐直接联系陆川，说明闪奔到家的人上门抢单时，连她各门店高峰时段、常见延误点、配送赔付情况都说得一清二楚，像是把迅城达内部配送档案整包端走了。陆川意识到，这已经不是普通抢人，而是有人从公司里面往外递刀子。",
  "next_chapter_bridge": "下一章从赵姐提供的异常细节切入，陆川联动苏蔓、何小满和老周，顺着商户数据、调度权限和接触名单往回查，开始把‘市场挖角’升级为‘内部信息外流’的调查线。"
}