{
  "chapter_index": 18,
  "chapter_title": "他抢人，我抢真相",
  "opening_state": "外部竞争者持续挖站长、抢商户，内部关于陆川失控、公司将崩的风声越传越真。郑维正试图利用核心站点集体倒戈，坐实“陆川压不住局面”的判断。陆川手里已有异常数据线索，但还缺能直接指向内外勾连的硬证据；与此同时，老周等基层核心人物虽然受够了总部，但在前期止血和改规则后，开始愿意再信陆川一次。苏蔓、何小满与少数可信站点已具备联动基础，但彼此仍处于高压和试探中。",
  "ending_state": "陆川成功连夜稳住核心站点，没有让郑维制造出全面倒戈的既成事实；老周等人明确站到陆川一边，基层、技术、法务三线首次形成真正可执行的临时联盟。通过有意放出的有限信息和现场配合，郑维被逼加快动作，留下更直接的交易与汇报痕迹。章末，苏蔓截获一份准备发给董事会的内部报告，内容是主张立刻罢免陆川并拆分出售核心站点，局势骤然升级为董事会层面的正面决战前夜。",
  "protagonist_goal": "陆川本章的核心目标有两个：一是稳住老周等关键站长和骑手，不让人心被郑维和竞争对手彻底抢走；二是在不打草惊蛇的前提下，逼郑维主动露出更实的证据，为下一章公开反击和董事会对决做准备。",
  "obstacle": "阻碍来自双重夹击：其一，基层对总部长期失信，本来就一碰就炸，任何失误都可能让站长觉得自己又成了筹码；其二，郑维熟悉内部流程，能利用舆情、汇报节奏和人事恐慌制造“陆川已经控制不住局面”的观感，迫使董事会提前做切割决定。陆川还不能靠职权强压，因为他真正的短板仍是高层程序和话术场，必须依赖苏蔓和何小满补位。",
  "required_information": [
    "必须明确本章不是单纯抢人，而是“抢人心”和“抢真相”同步推进，标题含义要落到行动上。",
    "必须体现老周等人愿意配合做局，是出于对陆川真心改规则的认可，而不是被利益收买或被情绪煽动。",
    "必须展现陆川稳站点的方法仍然基于一线逻辑：收益、公平、送达、赔付、规则是否真改，而不是空口承诺。",
    "必须出现苏蔓的制度价值，她负责把陆川的现场动作和证据意识转成可在董事会、法务层面成立的抓手。",
    "必须出现何小满或技术侧的作用，说明郑维的破绽并非巧合，而是通过调度、权限、报表流转、异常数据等链条逐步逼出来的。",
    "必须让郑维显得专业且危险，不可写成低级失误暴露；他的破绽应来自被逼加速和过度自信。",
    "必须交代竞争对手挖站长、抢商户的压力仍在，外部威胁不能消失，否则内鬼线会显得悬浮。",
    "必须形成“少数可信力量第一次真正并肩”的章节核心体验，让陆川从单兵救火过渡到组织协同。",
    "必须为下一章董事会攻防埋好现实依据：内部报告、罢免建议、拆分出售核心站点的方案已经被启动。",
    "必须保留轻喜剧和身份反差感，例如陆川用极接地气的话拆穿高层话术，但整体基调以高压、谨慎、热血并肩为主。"
  ],
  "avoid_conflicts": [
    "不要把陆川写成突然精通法务、审计或资本运作，相关判断必须由苏蔓等盟友补位完成。",
    "不要让证据获取过于轻松，不能靠一次偷听、一次偶遇、一个神秘人爆料就直接坐实全部真相。",
    "不要让老周等基层人物无条件忠诚，他们的转向必须建立在前期陆川确实解决过问题、改过规则的基础上。",
    "不要让郑维降智，他应是被局势逼得加快动作而露痕，不是自己胡乱犯蠢。",
    "不要写成纯阴谋戏，仍要保留公司系统性失真、站点真实焦虑、运力和收益压力这些现实根基。",
    "不要让外部竞争者消失或沦为背景板，本章的人心争夺必须有实际挖角和市场压力支撑。",
    "不要让陆川用身份压人或空喊兄弟情解决问题，必须落到具体承诺、具体规则、具体执行上。",
    "不要出现凭空资金支持、神秘后台介入或创始人突然醒来远程定局等外挂手段。",
    "不要让苏蔓对陆川的支持变成感情线主导，前20章仍以事业线、规则线、同盟建立为主。",
    "不要与既定成长线冲突：本章应体现陆川开始具备组织协同与主动反击能力，但尚未完成最终坐实位置。"
  ],
  "emotion_curve": [
    "开场压迫：站点风声四起，陆川处在被人心和时间同时追着跑的状态。",
    "试探紧绷：陆川去见老周等人，既要讲真话又怕任何一句像总部套话，气氛悬着。",
    "局部回暖：老周等人表态愿意配合，读者感受到这不是表面站队，而是基层第一次把信任押给陆川。",
    "并肩升温：站点、技术、法务开始联动做局，形成少见的团队感和热血感。",
    "中段惊险：郑维动作比预期更快，局势差点失控，证据链和人心链都面临断裂风险。",
    "冷静反制：陆川不硬冲，靠现场判断和盟友配合把局面重新拉住，体现成熟一层的掌舵感。",
    "短暂胜利：核心站点稳住，郑维也确实露出更清晰的痕迹，读者获得阶段性爽点。",
    "结尾再压顶：苏蔓截获罢免与拆分报告，说明真正的战场已从站点夜战升级到董事会决战，形成更大的危机钩子。"
  ],
  "cliffhanger": "苏蔓在关键流转节点截获一份准备提交董事会的内部报告，报告将当前混乱定性为陆川管理失控，并建议立刻罢免他、拆分出售核心站点止损；更要命的是，这份报告的形成时间点，正好与郑维刚刚暴露出的异常动作高度吻合。",
  "next_chapter_bridge": "下一章可直接衔接为董事会前夜的证据整理与攻防部署：陆川需要把站点侧的人心、技术侧的异常链条、法务侧截获的内部报告拼成一套能公开出手的完整逻辑，同时面对韩啸、魏岚等人在董事会层面的程序压制与切割话术。"
}