{
  "chapter_index": 5,
  "chapter_title": "一张调度单，撕开第一道口子",
  "opening_state": "陆川刚被推上临时董事长位置不久，管理层表面配合、实则把他当摆设。会议室里仍由韩啸主导节奏，所有人强调指标、模型和资本观感，却没人真正解释站点履约为什么持续恶化。陆川已经察觉问题不在嘴上，而在调度规则对一线现实的背离，但他还没有真正动用过自己的权限。",
  "ending_state": "陆川顶着韩啸的反对，第一次以临时董事长身份下达局部回切人工经验派单的强制指令，正式把手伸进运营核心。何小满被他从沉默边缘位拉出来，开始向他透露系统被人为改坏的内幕，成为潜在盟友。韩啸表面执行、暗中记账，准备把后续一切负面结果都归到陆川头上。就在陆川以为至少撕开了一道口子时，核心站点传来骑手集体停单的坏消息，局面不但没轻松，反而升级。",
  "protagonist_goal": "陆川想证明问题出在脱离现实的调度策略上，而不是一线不肯干；他要先把部分热点片区的派单逻辑改回更贴近现场的方式，看看能不能止住履约继续下滑，同时也借这次动作证明自己不是坐着背锅的招牌。",
  "obstacle": "最大阻碍来自韩啸代表的管理层阻力：他们坚持系统不能乱动，担心影响报表、指标和对外口径，也担心一旦承认模型有问题就等于承认此前管理决策失误。技术侧不敢说真话，何小满知道问题却缺少话语权。陆川自己又不懂技术黑话与会议程序，容易在表达上显得粗糙，给对方留下“外行乱指挥”的把柄。",
  "required_information": [
    "必须明确展示陆川判断问题的依据来自一线履约经验，而不是拍脑袋逞强。",
    "必须出现调度策略与真实配送场景的具体错位，比如热点片区、跨区派单、空跑、超时赔付等现实问题。",
    "必须写出韩啸反对的逻辑不能降智：他不是单纯嘴硬，而是从指标稳定、系统风险、资本观感和责任归属角度施压。",
    "必须让陆川第一次正式使用临时董事长权限下指令，形成身份与行动上的阶段性跨越。",
    "必须埋入何小满的关键透露：现有模型不是技术团队不会做，而是被上层强行改成更好看数据的版本，真实效率被牺牲。",
    "必须建立何小满对陆川态度的变化，从谨慎观望到愿意私下开口。",
    "必须体现苏蔓的辅助价值，可以是帮陆川确认权限边界、提醒程序风险或把他的‘人话’翻译成会议可执行命令。",
    "必须写出这次调整只是局部回切，不是陆川一声令下全盘推翻系统，保持现实感。",
    "必须让韩啸在表面服从中埋下后手，明确其后续会把结果甩锅给陆川。",
    "必须以核心站点骑手集体停单消息作为结尾升级，说明问题比单一调度错误更复杂。"
  ],
  "avoid_conflicts": [
    "不要把陆川写得像天生懂系统架构或算法，他只能凭现场经验指出不合理，再借何小满补技术解释。",
    "不要让调度问题被一句话轻松解决，局部回切后仍应暴露更深层的人心与站点问题。",
    "不要让韩啸显得愚蠢无能，他应当专业、会控场、会用程序和责任语言压人。",
    "不要出现董事长权限大到无人敢反对的失真场面，陆川的命令应伴随质疑、程序摩擦和执行掣肘。",
    "不要脱离行业硬规则，冲突必须围绕履约率、运力分配、赔付压力、商户体验和报表口径展开。",
    "不要让何小满无缘无故倒向陆川，他的转变应建立在长期压抑和对现实问题的清楚认知上。",
    "不要把问题全写成阴谋，当前仍要突出管理失真和数据好看优先于真实效率的系统性烂法。",
    "不要让陆川突然变得享受权力，他的出手核心仍是‘别让一线白赔、别拿现实给报表陪葬’。"
  ],
  "emotion_curve": [
    "憋闷：陆川在会议或汇报场景里继续被黑话和报表绕得心烦，感到公司正在拿现实给面子工程垫底。",
    "起疑：随着具体调度单或片区数据展开，他越来越确认问题不是骑手不行，而是派单规则在瞎指挥。",
    "对撞：陆川与韩啸正面硬顶，话语体系冲突升级，场面既紧张又带有身份错位的喜剧感。",
    "硬撑：陆川明知自己不擅长会议规则，仍笨拙但坚决地把命令压下去，完成第一次权力使用。",
    "松一口气中的不安：何小满私下吐露真相，让陆川第一次抓到实锤方向，但也意识到问题牵扯更深。",
    "骤沉：局部回切后没等到轻松结果，反而传来核心站点骑手集体停单消息，形成更大危机。"
  ],
  "cliffhanger": "就在陆川以为至少先把错误派单掰回一点时，老周那边的核心站点突然传来消息：骑手不是抱怨，而是直接集体停单，现场快压不住了。",
  "next_chapter_bridge": "下一章应直接转入站点现场，让陆川离开会议室去面对真正失控的一线局面；既要验证调度回切为何没立刻见效，也要揭开骑手停单背后的收益、赔付、信任和可能被人煽动的多重原因。"
}