{
  "chapter_index": 11,
  "chapter_title": "系统没疯，是有人让它疯",
  "opening_state": "站点止血后，公司表面稍微稳住，但热点区域仍频繁出现明明有运力却派单迟缓、冷区骑手空转的怪现象。陆川已经从基层和站长口中确认问题不只在线下执行，而是调度后台有硬伤；他刚建立起一点威信，却也因此开始真正踩进高层利益区。何小满知道系统被改过，却长期被压着背锅，不敢贸然开口。苏蔓则提醒陆川，接下来不能只靠拍桌子和现场直觉，必须把问题变成能落档、能追责、能在董事会站得住的证据链。",
  "ending_state": "陆川没有急着公开翻脸，而是与何小满达成实质同盟，在苏蔓的提醒下开始按流程留痕、调取版本和审批记录，初步证明调度异常并非单纯技术失误，而是有人出于报表和管理目标故意修改关键参数。陆川第一次清晰意识到，自己接下来要对抗的不是单个故障，而是一整套拿一线履约给报表让路的决策逻辑。章节结尾时，后台操作记录与审批链的线索开始指向运营副总郑维。",
  "protagonist_goal": "查清调度系统异常的真实原因，先拿到足以自保和推动整改的证据，再决定怎么掀桌子；同时稳住何小满，让技术侧有人敢站到自己这边。",
  "obstacle": "韩啸以“避免技术动荡影响董事会判断”为由施压，要求先恢复原模型话术、压下排查节奏，把问题继续包装成暂时波动；何小满担心被上级清算，不敢直接指认；系统问题本身又被专业名词和权限壁垒包裹，陆川虽懂现场结果，却不天然掌握后台证据与制度抓手。",
  "required_information": [
    "必须明确写出调度异常的具体表现：热点区域响应被拖慢、冷区运力被平均摊薄、表面数据更平滑但真实履约更差。",
    "必须揭示关键参数被人为改向“平均分配”和“报表稳定”，本质是管理决策，不是系统自己抽风。",
    "必须让何小满登场并建立立体性：他不是单纯技术宅，而是长期知道问题却被流程和上级压制的人。",
    "必须推进陆川与何小满建立实质同盟，这是一线经验与技术视角第一次真正合流。",
    "必须让苏蔓发挥制度补位作用，明确提醒陆川：现场判断要转成书面链条、版本记录、审批痕迹，否则只会变成口水仗。",
    "必须体现韩啸的阻拦方式是现实型的，不是无脑反派发疯，而是用“稳定”“审慎”“别乱动系统”这类管理话术压制追查。",
    "必须表现陆川的成长：从想当场掀桌子的愤怒，转向先留证据、先把话说死在记录里，再找人算账。",
    "必须点出系统线和内鬼线开始接轨：异常参数不是孤立错误，背后可能连着更大的利益输送或路线斗争。",
    "必须保留章节核心反差：陆川依然用送单逻辑理解系统问题，比如先问‘这单为什么没人接、明明近的人为什么被绕开’，再逼出后台逻辑。",
    "必须在结尾抛出关键线索：后台操作记录的审批链最终指向郑维，但只能到“指向”层面，不能在本章直接坐实全部真相。"
  ],
  "avoid_conflicts": [
    "不能把陆川写成突然精通复杂技术原理，他应通过现场异常判断问题，再借何小满解释后台机制。",
    "不能让系统问题靠一句命令立刻修好，本章重心是发现和取证，不是彻底解决。",
    "不能把韩啸写成纯降智，他的阻拦应基于权责、风险控制和董事会观感，体现其老练。",
    "不能让何小满毫无挣扎就全盘倒向陆川，必须有顾虑、有试探、有自保心理。",
    "不能忽略前十章已经建立的现实基调，系统问题仍要落回站点、骑手、商户的真实损失，而不是悬浮讲技术。",
    "不能让苏蔓替陆川完成全部判断，她的作用是翻译规则、补足程序，不是代替主角破案。",
    "不能在本章直接公开郑维是内鬼或给出完整利益链，内鬼线应保持升级中的悬念。",
    "不能出现凭空黑客式取证、神秘权限、外挂式数据恢复，所有证据应来自公司正常系统痕迹、版本记录、审批流程或内部留档。",
    "不能丢掉轻喜剧和反差气质，即使进入系统线，也要保留陆川对黑话和形式主义的现实吐槽。",
    "不能让章节只剩会议戏，必须有后台、站点或具体派单案例作为问题落点。"
  ],
  "emotion_curve": [
    "表面稳住后的隐隐不对劲",
    "看到派单怪象后的烦躁与警觉",
    "发现技术侧有人知情却不敢说时的压抑",
    "听到韩啸继续拿话术压问题时的愤怒",
    "在苏蔓提醒下强行冷静、收住脾气",
    "与何小满试探合作时的谨慎与拉拢",
    "顺着记录摸到人为修改痕迹时的震惊与确认",
    "意识到自己碰到的是利益结构而非单点故障时的沉下心",
    "看到审批链指向郑维时的寒意与反击欲被吊起"
  ],
  "cliffhanger": "何小满调出被隐藏的版本操作记录后，发现那次把调度参数改向“平均分配”的变更并非技术自发优化，而是走过审批流程；最终签批节点，赫然挂着郑维的名字。",
  "next_chapter_bridge": "下一章可直接承接陆川、苏蔓、何小满三人如何在不惊动对方的前提下继续补全证据，同时验证郑维改参数后是否与异常赔付、站点流失和商户投诉存在时间线重合，为内鬼线深入做准备。"
}