{
  "chapter_index": 2,
  "chapter_title": "临时董事长，工服没换",
  "opening_state": "陆川仍处于强烈的错位和抗拒中，身上还是骑手工服，心理上把自己当成被临时拽来顶雷的外人；创始人留下的授权刚被摆上台面，公司高层、董事会成员和秘书体系都在观察他会不会当场退缩。",
  "ending_state": "陆川在程序上被正式按到临时董事长的位置上，短期合法性得到确认，但他也清楚自己只是被推到风口上挡雷的人；韩啸基本完成甩锅铺垫，魏岚选择冷眼旁观，苏蔓则成为少数愿意告诉他规则边界的人。陆川刚坐下就被一连串履约危机和投诉简报正面砸中，被迫从身份荒诞进入现实危机。",
  "protagonist_goal": "陆川本章最直接的目标是拒绝接任、避免莫名其妙背上公司的锅，同时尽量搞清楚这份授权到底是真是假、自己究竟会被推到什么位置上。",
  "obstacle": "最大阻碍是授权文件在程序上居然站得住脚，苏蔓确认短期内难以推翻；与此同时韩啸表面配合、实则积极推动授权落地，故意把局面做成既成事实，好把后续业绩、舆情和经营风险都压到陆川名下。董事会和高管群体的轻蔑、围观与试探，也让陆川很难体面抽身。",
  "required_information": [
    "必须明确创始人留下的临时授权在程序上有效，不是随口一句话或口头玩笑。",
    "必须交代授权是有效但边界模糊的：能让陆川坐上位置，却不足以彻底压服所有人，为后续权力争夺留下空间。",
    "必须展示陆川外形和气质与董事长身份强烈不匹配，工服未换是本章核心反差意象。",
    "必须让韩啸表现出成熟的职场操盘能力：不是简单发坏，而是顺势把陆川塑造成挡火墙和责任承接人。",
    "必须交代魏岚的态度不是立刻打压，而是理性观望，把陆川当临时棋子测试价值和承压能力。",
    "必须建立苏蔓的功能：她懂程序、懂文件、懂会议语言，能把复杂规则翻译给陆川，但此时仍带观察和保留态度。",
    "必须让陆川清晰意识到自己不是被请来解决问题，而是先被摆到台前承担结果。",
    "必须埋下公司危机不是抽象亏损，而是已经逼近履约端爆雷，包括超时、商户投诉、站点欠款等具体问题。",
    "必须体现高管和董事会的轻蔑、利用与围观心理，让读者明确本章核心不是权力荣耀，而是荒诞上位与系统性甩锅。",
    "必须为下一章现场危机开门：本章结尾收到的紧急简报要具体、密集、有压迫感。"
  ],
  "avoid_conflicts": [
    "不能把陆川写得像天生适应董事长位置的人，他应该抗拒、别扭、烦躁，且第一反应是想跑。",
    "不能让陆川本章就轻松掌控会议或震住全场，他此时只有名义位置，没有真正权威。",
    "不能把韩啸写成低级反派，他应当有管理话术、程序熟练度和借势布局能力。",
    "不能让授权文件强到无敌，必须保留模糊地带，以符合后续争夺线。",
    "不能让苏蔓无条件站队，她此时应是专业协助加理性观察，不是立刻死忠。",
    "不能突然引入陆川精通法律、董事会规则、资本运作等超出设定的能力，相关判断应主要来自苏蔓解释和陆川直觉反应。",
    "不能把公司危机写成纯阴谋操作，根子仍应是管理失真、履约失控和系统性烂法。",
    "不能让本章直接解决任何核心经营危机，本章重点是位置坐实和甩锅格局成形。",
    "不能让魏岚表现得情绪化或脸谱化，她应保持投资人式冷静止损视角。",
    "不能脱离行业现实，所有压力都应落到真实业务后果上，而非空泛财务术语堆砌。"
  ],
  "emotion_curve": [
    "荒诞：陆川穿着工服被推向董事长位置，场面本身就可笑又离谱。",
    "抗拒：他本能拒绝接盘，认定这事就是让自己背锅。",
    "羞辱：高管和董事会的目光、话术和试探让他感到被围观、被轻视。",
    "憋屈：苏蔓确认授权有效，陆川发现不是一句不干就能脱身。",
    "警觉：他逐渐察觉韩啸是在借程序和场面把责任固定到自己头上。",
    "硬着头皮落座：不是接受荣耀，而是被现实逼着先坐下。",
    "压迫感陡升：刚坐上去就看到履约、商户、站点问题同时扑来，荒诞感迅速转成真实危机。"
  ],
  "cliffhanger": "陆川刚被按上临时董事长的位置，手机和简报就同时炸开：核心区域爆单超时、商户集中投诉、多个站点催讨欠款，甚至有人放话要停运，他连椅子都没坐热，就发现这不是头衔，是一口已经烧开的锅。",
  "next_chapter_bridge": "下一章直接承接这波紧急简报，让陆川从会议室被拽进真实业务问题中；可由他先质疑报表和汇报，再被迫接触站点或调度端的第一手异常，为后续‘去现场、发现高层汇报与现实不一致’做起步铺垫。"
}