{
  "chapter_index": 1,
  "chapter_title": "骑手被请进董事会",
  "opening_state": "陆川处于最普通也最紧绷的送单日常中：穿工服、赶时效、盯赔付、惦记还债，只想把手头单子准时送完多挣提成。他对迅城达总部与高层事务没有任何参与意愿，天然排斥开会和官话。与此同时，迅城达总部正处于创始人程振山突发健康危机、管理层慌乱控场的紧急状态，公司内部已有明显崩盘气息，但陆川此时只把它当成与自己无关的麻烦。",
  "ending_state": "陆川被强行留在总部权力现场，从一个无关的骑手变成所有人目光中心。苏蔓当众宣读程振山留下的临时授权与签字文件，确认陆川被指定为临时董事长。高层震惊、质疑、各怀心思，陆川本人则处于强烈错愕和抗拒之中，荒诞上位正式落槌。",
  "protagonist_goal": "陆川本章最直接的目标不是争权，而是尽快脱身、别被卷进总部烂事、别耽误送单和收入，更不想替一家大公司背莫名其妙的锅。",
  "obstacle": "阻碍来自三层：第一，创始人程振山在病倒前明确点名要见陆川，并留下有效授权，使陆川无法以“与我无关”轻易抽身；第二，总部高层出于控局、甩锅和试探心理，不会轻易放他离开，反而会把他推到台前；第三，陆川自身对会议室规则、权力语言和当前局势一无所知，导致他越想脱身，越容易被裹挟得更深。",
  "required_information": [
    "明确建立陆川的骑手身份、经济压力和一线思维方式，让读者知道他最在意的是时效、赔付、收入和公平。",
    "迅城达当前处于危机边缘，至少要让读者感知到创始人出事、总部混乱、公司气氛不对、管理层明显在压事。",
    "陆川进入总部不是主动求上位，而是送单途中被卷入，必须突出荒诞和被迫。",
    "程振山不是随手抓错人，而是在意识尚清时明确点名陆川，留下口头态度与签字文件，形成合法性来源。",
    "授权内容必须是“含糊但有效”，既足以震动全场，也为后续围绕授权有效性、范围和真实动机的博弈留空间。",
    "苏蔓需要首次出场，并表现出专业、冷静、先观察后下注的态度，她不是立刻站队，而是注意到这件事不寻常。",
    "高层对陆川的基本态度应是轻视、排斥、当成意外变量或替罪羊苗子，而不是立刻服从。",
    "本章要种下核心疑问：程振山为什么偏偏选陆川，这不是正常人事安排。",
    "要让读者感到公司真正的问题不只是老板病倒，而是体系早就出了问题，只是本章先点到为止，不全面展开。",
    "结尾必须完成身份炸弹的公开揭示，让“骑手当临时董事长”的主设定在章末落地。"
  ],
  "avoid_conflicts": [
    "不能把陆川写得像天生适合董事会的霸总，他必须明显不适应、抗拒、说人话且想离场。",
    "不能让程振山的授权显得像儿戏或纯胡闹，必须有现实上的程序抓手，例如签字文件、证人或当场确认。",
    "不能让高管集体降智，震惊之余应有各自反应逻辑：质疑程序、考虑风险、盘算责任，而不是只会瞪眼。",
    "不能让陆川在第一章就展现高阶资本、法律或董事会操作能力，他此时只能凭本能判断局面不对。",
    "不能把公司危机写成单一阴谋，第一章应主要呈现管理失控与权力真空的紧张感。",
    "不能让苏蔓一上来无条件帮助陆川，她应保持职业判断和观察姿态。",
    "不能让陆川主动争位或觉得这是机会，他的第一反应必须是麻烦、离谱、会耽误挣钱。",
    "不能弱化行业真实感，哪怕场面荒诞，也要保持即时配送行业的现实压力背景。",
    "不能在第一章就解释清楚程振山选择陆川的全部原因，必须保留悬念。",
    "不能把一线骑手困境当纯笑料，陆川对送单、超时、赔付和还债的焦虑要真实存在。"
  ],
  "emotion_curve": [
    "紧绷：从赶单和现实压力切入，先立住底层日常的急。",
    "错愕：陆川莫名被卷进迅城达总部异常事件，感到这事离谱。",
    "荒诞：一个骑手被带进本不属于他的权力场，身份反差形成喜剧感。",
    "憋屈：高层的轻视、拦阻和话术让陆川想走走不了，产生被裹挟感。",
    "不安：程振山点名见他并留下东西，陆川意识到事情不是偶然。",
    "炸裂式悬停：临时董事长身份被公开，全场震动，情绪停在最大反差点。"
  ],
  "cliffhanger": "苏蔓在众目睽睽下宣读程振山留下的临时授权，明确指定陆川担任迅城达临时董事长；陆川本人还穿着骑手工服，现场瞬间死寂后爆发质疑。",
  "next_chapter_bridge": "下一章直接承接授权公布后的会议室混乱：陆川强烈拒绝、高层立刻围绕授权效力和责任边界展开博弈，苏蔓开始用程序语言把他暂时按在位置上，正式开启“他只想走，所有人却非要他坐下”的局面。"
}