{
  "chapter_index": 19,
  "chapter_title": "董事会上，把单号一笔一笔摊开",
  "opening_state": "公司处于第18到20章决战段的核心听证时刻。董事会临时会议被拉成事实审判场，外部舆情未彻底平息，核心商户和站点仍在观望。韩啸试图继续把近期履约混乱、系统异常和赔付失控归因于陆川上位后的‘乱改’，郑维则装作积极配合调查、准备把自己隐藏在流程细节里。陆川手里已经联合苏蔓、何小满、站点端拿到了关键证据，但这些证据必须在董事会这种讲程序、讲责任链的场合被说清、说硬、说到无法回避。",
  "ending_state": "陆川以订单单号、赔付去向、后台权限日志、商户名单外泄时间线和站点异常流失记录，建立起完整证据链，当场拆穿郑维与外部竞争方长期利益输送的事实，并证明最近的关键事故不是自己乱改造成，而是被既有错误路线和内鬼操作放大。郑维被当场控制、失去话语权；韩啸虽未被直接定性为同谋，但被明确钉在‘长期默许好看数据优先、放任真实履约失真’的责任位上。董事会不得不承认陆川不仅判断对，而且取证与复盘能力足以掌舵；魏岚开始从‘尽快拆卖止损’转向‘先看能否继续运营增值’的重新评估。",
  "protagonist_goal": "陆川本章的直接目标不是吵赢董事会，而是把内外勾连从抽象怀疑变成无法抵赖的业务事实，洗掉自己头上的锅，夺回对公司问题定义权，并逼董事会承认真实病根在路线失真和内部蛀空，不在一线止血动作本身。",
  "obstacle": "最大阻碍有三层：第一，董事会天然偏向听‘制度语言’和‘责任口径’，陆川如果只讲现场感觉会被打成情绪化；第二，韩啸擅长控场和转移责任，会把所有异常包装成陆川越权、破坏流程的后果；第三，郑维熟悉内部流程，能把泄密和利益输送切碎成看似偶然的节点，导致证据若不形成链条，就不足以定死。更深层阻碍是：即便抓出一个内鬼，也无法自动证明公司值得继续救，这让陆川的反击必须兼具‘追责’和‘证明还有救’两重功能。",
  "required_information": [
    "必须明确本次董事会/听证会的性质：不是普通汇报，而是围绕近期事故、舆情和责任归属的关键审议场合。",
    "必须出现韩啸的核心指控口径：将履约混乱归因于陆川上位后对系统、站点规则和奖惩节奏的调整。",
    "必须出现陆川选择不用空泛辩解，而是直接摊开具体单号、具体时间、具体赔付记录的打法，形成‘人话打穿黑话’的爽点。",
    "必须交代证据链至少包含四个维度：订单异常、赔付流向、后台权限日志、商户名单外泄时间线。",
    "必须揭示郑维与外部竞争对手存在长期利益输送，不是临时起意，而是持续、分段、隐蔽地进行。",
    "必须说明外泄内容不只是商户名单，还包括运力紧张区间、站点脆弱点或系统参数信息，使外部抢人抢单和舆情踩点变得精准。",
    "必须指出系统不是天然烂，而是被错误路线和人为修改带偏；何小满这类技术侧证词或材料要为此提供支撑。",
    "必须呈现苏蔓的功能：把陆川的现场逻辑和证据组织成董事会听得懂、无法绕开的程序性表达。",
    "必须明确韩啸未必直接收钱或直接勾连外部，但他推动或默许‘好看数据优先’、压制真实问题上报，客观上给内鬼提供了生长土壤。",
    "必须让董事会的态度发生变化，不是被陆川骂服，而是被完整责任链和业务链打服。",
    "必须出现郑维失去话语权的实质性结果，如被要求交出设备、暂停权限、由保安或法务介入控制场面。",
    "必须埋下本章后的现实压力：即便证据公开，明天核心站点和商户是否回稳，仍决定公司是继续运营还是被拆卖。",
    "必须保留本书主题：真正决定公司死活的，不是会议室里的话术，而是谁能把一线真实问题讲清并解决。"
  ],
  "avoid_conflicts": [
    "不要把陆川写成突然精通法律审计或资本调查，他的优势应是抓现场异常、记业务细节，制度表达需由苏蔓补位，技术细节需由何小满补位。",
    "不要让证据来源凭空出现，必须体现此前第15到18章持续追查、站点反馈、系统日志留痕和赔付异常复盘的积累感。",
    "不要把韩啸直接写成与郑维同级别的明确内鬼，按当前规划他更适合作为路线错误和责任甩锅的代表，而非简单黑化成同谋。",
    "不要让董事会成员集体降智，质疑、打断、要求解释都应合理，陆川需要逐条反证而不是一句话秒杀全场。",
    "不要把问题归结为纯阴谋，必须保留公司原本就存在的系统性管理失真，否则会冲掉本书现实根基。",
    "不要让外部竞争对手沦为背景板，应通过外泄时间线与对方行动节点对应，体现其专业且现实的攻击性。",
    "不要让郑维在证据被打穿后还靠夸张狗血逃脱，本章重点是公开定性与失权，不必上升到过度戏剧化追逐。",
    "不要写成纯会议嘴炮，需通过单号、站点、商户、后台记录让业务现场感持续存在。",
    "不要让陆川表现出霸总式掌控气场，他依然应像一个被逼到这一步、但把账算得比谁都清楚的一线人。",
    "不要提前完成第20章的终局，陆川本章可以坐实能力与位置，但‘主动留下’的情绪升格应在下一章进一步完成。"
  ],
  "emotion_curve": [
    "压抑：会议气氛偏冷，陆川仍被当成主要责任人之一，局势看似对他不利。",
    "克制：陆川没有先吵，先让对方把锅甩完，形成对比和蓄力。",
    "反打启动：他从第一笔异常订单和第一条权限记录开始，一条条拆对方口径。",
    "爽感上升：韩啸的黑话叙事被具体单号击穿，董事会成员开始从怀疑转向沉默和追问郑维。",
    "重锤落下：赔付流向、名单外泄和外部动作时间线对上，郑维无法自圆其说，当场失势。",
    "解气中带沉重：陆川不仅抓出一个内鬼，还指出公司这些年追求好看数据的路线问题，让胜利不轻飘。",
    "短暂稳住：董事会承认他判断有效，魏岚态度松动，公司出现继续救的可能。",
    "再度绷紧：虽然人揪出来了，但明天站点和商户回不回稳仍悬着，胜利只是夺回了抢救资格。"
  ],
  "cliffhanger": "郑维被控制后，魏岚没有立刻宣布彻底支持陆川，而是冷静抛出最后一道现实门槛：证据能证明谁在害公司，却不能替公司完成履约。若明天一早核心商户订单和关键站点出勤仍起不来，拆卖方案照样推进。",
  "next_chapter_bridge": "下一章应直接承接‘证据战赢了，但运营战还没赢’的局面。陆川需要把董事会刚被打出来的短暂窗口，立刻转化为对站点、商户和运力的回稳动作，并在这个过程中作出第一次真正主动留下继续掌舵的决定。"
}