{
  "chapter_index": 8,
  "chapter_title": "赵姐不听战略，只问今天送不送得到",
  "opening_state": "陆川刚靠站点止血赢到一点内部喘息，但公司外部信任并没有恢复。核心商户赵姐因连续超时、异常单没人接、客服失联、赔付拖延，已经准备把多个高频门店切给竞争对手。韩啸试图用统一口径和延后承诺先稳住场面，不想让商户问题直接暴露成系统性失信。陆川必须立刻面对真正付钱的人，证明自己不是只会在站点救火。",
  "ending_state": "陆川没有靠空话留人，而是当场拿出今晚即可落地的临时止损方案：门店白名单、专人盯单回传、异常单直连处理、赔付当日确认口径。赵姐虽然仍不信总部，但愿意给他和方案一晚观察期。陆川与赵姐建立起带火药味但有效的直接沟通关系，商户端首次出现可见的短暂止损窗口，同时也把次日午高峰变成必须扛住的公开考核。",
  "protagonist_goal": "在不靠董事长身份压人的情况下，稳住赵姐及其门店不立刻流失，并用一个能今晚执行的具体方案重新建立最基础的商户信任。",
  "obstacle": "阻碍来自三层：第一，赵姐已经被连续失约磨到不信任何战略与解释，只看今天能不能送到、异常谁负责；第二，公司客服、赔付、调度之间链条断裂，陆川即便想承诺也缺少现成可靠支撑；第三，韩啸更在意控话术和遮丑，天然反对把真实问题摊开，可能拖慢或稀释陆川的现场承诺。",
  "required_information": [
    "必须明确赵姐代表的不是单一客户，而是掌握多个高频门店的关键商户资源，她的去留会影响一片区域订单与口碑。",
    "必须点明商户流失核心不是价格高低，而是不再相信迅城达会对异常履约负责。",
    "必须具体呈现商户最痛的环节：爆单超时、骑手联系不上、客服失联、异常反馈没人闭环、赔付拖延。",
    "必须让陆川直接听到商户语言，与高管的战略黑话形成鲜明反差。",
    "必须体现韩啸想先稳口径、压问题、做表面安抚，与陆川的现场解决逻辑正面冲突。",
    "必须让陆川提出可执行的临时方案，而不是抽象承诺，且方案至少包含门店白名单、专人回传、异常单直连、赔付当日确认四个要点。",
    "必须说明该方案是临时止血，不是根治，根问题仍在客服链条、调度稳定性和赔付机制失真。",
    "必须体现陆川的优势来自一线履约理解：他知道商户要的是确定性、回应速度和责任归属，不是愿景。",
    "必须让赵姐对陆川的态度从纯粹不耐烦转为勉强观望，建立针锋相对但真实的沟通关系。",
    "必须埋下次日午高峰考验，为下一章的执行危机和结果验证做准备。"
  ],
  "avoid_conflicts": [
    "不能把赵姐写成轻易被几句漂亮话说服，她必须现实、强硬、只认结果。",
    "不能让陆川突然精通公关、法务或赔付制度设计细节，制度表述可借助苏蔓，但核心判断必须来自他的现场经验。",
    "不能让问题靠董事长身份一句话解决，必须通过调人、盯单、回传、担责等具体动作形成方案。",
    "不能把韩啸写成无脑反派，他应当有维护公司形象和控制风险的管理逻辑，只是与陆川的优先级冲突。",
    "不能出现公司突然资源充足、运力瞬间恢复等失真设定，方案应建立在有限资源下做优先级。",
    "不能吃掉前文主线：公司核心危机仍是履约系统和管理失真，不是单纯客户刁难。",
    "不能让商户端止损被写成彻底胜利，本章只能赢得观察期和试点机会。",
    "不能削弱陆川人物底色，他依然最在意送达、赔付、公平和别让一线与商户白白吃亏。"
  ],
  "emotion_curve": [
    "开场紧绷：陆川意识到站点刚稳，商户端却已经要塌。",
    "中段丢脸：赵姐当面拆穿总部空话，把连续失联和拖赔问题摔到脸上。",
    "冲突升级：韩啸想控场，陆川被夹在公司面子和商户怒火之间。",
    "转折发力：陆川放弃讲战略，改讲今晚怎么送、谁盯、谁回、谁认。",
    "短暂回暖：赵姐第一次愿意继续听，火药味里出现一点实用信任。",
    "尾声再绷紧：观察期不是和解，而是更狠的次日午高峰死线。"
  ],
  "cliffhanger": "赵姐最终只给陆川一晚时间，并撂下条件：如果次日午高峰再炸，她不只是自己走，还会带着整片门店一起切去闪奔到家。",
  "next_chapter_bridge": "下一章直接进入试点方案的实操验证：陆川必须连夜协调站点、调度、客服和回传机制，把对白名单门店的承诺顶住；同时午高峰将暴露公司内部哪一环最先掉链子，也为后续更深层的系统问题埋下证据。"
}