{
  "chapter_index": 3,
  "chapter_title": "第一场会，没人说人话",
  "opening_state": "陆川以临时董事长身份第一次正式进入高管例会，位置坐得别扭，人也明显不属于这个场子；多数高管表面恭敬，实际把他当创始人留下的临时摆设和背锅位。公司对外仍维持“局面可控”的说法，但内部履约、赔付、站点稳定都在持续恶化。",
  "ending_state": "陆川在会议中彻底确认总部汇报与一线现实严重脱节，不再把这场上位当成单纯荒唐意外；苏蔓开始重新评估他，认为他的问题抓得比高管汇报更准；韩啸则被当众打断后对陆川生出明确敌意。陆川提出停止空谈、直接去现场看仓，推动故事从会议室转向真实业务现场。",
  "protagonist_goal": "先搞明白这家公司到底烂在哪、今天最急的火点在哪里，并尽量别在会议上被当成纯笑话和替罪羊。",
  "obstacle": "高管层用黑话、报表和流程包装现实，把问题描述成可优化的阶段性波动，刻意回避具体站点、实时工单、赔付责任和运力情绪；陆川缺乏会议规则与话语经验，身份合法但权威虚弱，一开口就容易被视为不专业、破坏秩序。",
  "required_information": [
    "必须写出陆川第一次坐进正式高管会议的强烈身份错位感，形成荒诞喜剧效果。",
    "必须体现高管汇报内容与一线真实问题之间的脱节，尤其是满口战略协同、履约优化、生态修复，却没人回答具体爆仓站点和赔付责任。",
    "必须点出公司真正的核心危机不是一句“舆情”或“事故”，而是履约系统、站点稳定和管理失真。",
    "必须出现数据层面的异常信号：总部报表显示履约可控，但实时工单、超时单量、赔付或站点反馈明显不对劲。",
    "必须让陆川提出基于一线经验的直白问题，例如今天哪里要爆、谁来赔、骑手为什么要继续跑，借此建立他与高管语言体系的反差。",
    "必须推进苏蔓对陆川的观感变化，她从把他当挡火墙，转为发现他的问题确实击中要害。",
    "必须建立韩啸的作风：擅长控场、包装、压话题、转移责任，并在本章把陆川视为麻烦。",
    "必须埋下后续现场核查的动力，让“去仓里看”成为下一章行动起点，而不是单纯情绪发作。",
    "必须让读者看明白：陆川不是突然会管理，而是比会议室里的人更懂末端履约到底怎么死。",
    "必须保留轻喜剧节奏，但笑点要来自语言错位、仪式感翻车和现实打脸，不可写成纯闹剧。"
  ],
  "avoid_conflicts": [
    "不要把陆川写成一进会议室就气场碾压全场的霸总，他应当别扭、烦躁，但问题问得准。",
    "不要让陆川靠一句拍桌子就直接掌控局面，本章重点是识别失真、提出质问、推动转场，不是立刻赢下权力斗争。",
    "不要让高管全部降智，他们应有完整汇报逻辑和自保话术，只是脱离现场或有意过滤信息。",
    "不要让陆川突然精通财务、法务、资本术语，他应主要依据送达、赔付、路线、站点常识判断问题。",
    "不要把数据异常直接写成已经查明的阴谋证据，本章只能到“汇报失真或被过滤”的程度。",
    "不要让苏蔓过早无条件站队，她应是理性观察后开始松动。",
    "不要跳过董事长身份的尴尬合法性，其他人对他的态度应混合敷衍、试探、看戏和防备。",
    "不要把公司危机写成单点事故，必须保持其系统性：履约、站点、赔付、调度、管理层叙事共同失真。",
    "不要在本章直接解决现场问题，真正行动应留到下一章展开。",
    "不要吃书，陆川的关注重点必须始终落在送达、赔付、骑手收益、公平责任上。"
  ],
  "emotion_curve": [
    "荒诞：陆川被迫以最不合身的身份坐进最讲仪式感的会议室。",
    "好笑：高管黑话连篇，与陆川的人话视角形成强烈反差。",
    "不耐烦：陆川发现所有人都在绕着问题说话，没有人落到具体站点和订单。",
    "烦躁：报表看着平稳，但他凭经验察觉数据味道不对，越听越觉得假。",
    "火气上升：韩啸控场、转话题、压问题，让陆川确认这不是误会而是系统性失真。",
    "顶撞反打：陆川打断汇报，抛出最现实的问题，把会议室体面撕开一道口子。",
    "短暂凝滞：众人被问住，苏蔓开始真正注意他，韩啸敌意成形。",
    "动作决心：陆川不再陪他们空转，提出立刻去仓里看现场。"
  ],
  "cliffhanger": "会议气氛僵住时，陆川直接拍桌打断PPT：‘别放了。你们说可控，那现在带我去仓里看。谁不敢去，谁心里有鬼。’",
  "next_chapter_bridge": "下一章直接承接陆川要求离开会议室去现场核查，可从韩啸试图阻拦、苏蔓出面协调程序，或陆川强行点名要看某个异常站点/仓开始，正式进入“现实打脸高层汇报”的现场戏。"
}