{
  "chapter_index": 17,
  "chapter_title": "顺着一条日志，摸到一只手",
  "opening_state": "陆川刚从连续被动应对的局面里勉强站稳，已经确认公司近期几次站点失血、商户流失和舆情发酵之间存在不自然的同步，但手里还只有异常感和零散线索，无法直接摆上董事会。郑维表面继续参与救火，实则提高警觉，开始压内部口风、删改流程痕迹。苏蔓提醒陆川，任何证据如果取证路径不合规，都可能被反咬成越权调查。何小满则掌握后台结构，知道系统确实留下过不该有的参数同步与名单调用痕迹，但还没形成完整证据链。",
  "ending_state": "陆川、苏蔓、何小满初步拼出一条可用于反击的链条：异常访问并非普通系统故障，而是经由第三方服务商账号中转，关联到与闪奔到家合作的公关公司；郑维疑似利用这条灰色通道绕开部分内部监控，完成商户与站点名单转移、关键参数同步和舆情配合。更重要的是，苏蔓已经为后续固定证据设计出合规路径，何小满也从配合者变成关键执行人。陆川不再只是怀疑内鬼，而是开始有意识布网，准备在郑维下一次动作时抓现行。但郑维也先一步出手，开始秘密接触核心站长，局势转入争分夺秒。",
  "protagonist_goal": "陆川本章的核心目标，是把自己对内鬼的现场直觉升级成可以公开使用的证据链，至少先证明三件事有关联：内部越权访问、名单外泄、外部竞争对手借舆论与挖角同步打击公司，从而为后续反击和保住站点争取主动权。",
  "obstacle": "最大阻碍在于证据既难找又不能乱拿：郑维熟悉内部流程，已经在清理痕迹并可能预设甩锅说辞；系统日志复杂，单靠陆川看不懂，单靠技术又未必知道业务异常代表什么；而且一旦取证程序不合规，郑维就能把问题扭成陆川非法查人、越权翻后台，反而把主角推回被动。与此同时，时间窗口很短，站长和商户可能在证据落地前就被挖走。",
  "required_information": [
    "明确写出陆川的调查不是突然变成侦探，而是源于他对站点流失节奏、商户失联顺序、调度异常时点之间不正常重合的现实判断。",
    "必须出现何小满从技术视角解释日志、账号权限、参数同步等内容，但表达要尽量落地，让读者能理解，不要堆术语。",
    "必须出现苏蔓对合规取证边界的提醒与设计，强调证据是否能上董事会、是否能挡住反咬，不只是能不能查到。",
    "必须揭示关键发现：异常IP或访问来源与闪奔到家合作的公关公司有关，不是单纯外部黑客入侵，也不是普通运营失误。",
    "必须说明郑维不是直接用自己工号裸奔操作，而是借第三方服务商或灰色账号绕开部分内部监控，这样才能解释为什么之前一直抓不到完整痕迹。",
    "必须体现陆川、苏蔓、何小满三人的分工互补：陆川负责判断异常是否真有业务意义，苏蔓负责规则和程序，何小满负责技术落地。",
    "要让陆川完成一次阶段性转变：从被动解释、被动救火，升级为准备设局反制，对下一步抓现行动了念头。",
    "需要埋下郑维已经察觉风向不对、开始加速动作的信号，为结尾核心站长被秘密约谈做铺垫。",
    "必须让老周在本章中以外围反馈者身份出现或被提及，体现站点端已经感到有人在私下活动，不让结尾情报显得突兀。",
    "要强调证据链还未完全闭环，当前只是摸到手，不是已经彻底按住人，避免本章提前解决大冲突。"
  ],
  "avoid_conflicts": [
    "不要把陆川写得突然精通网络取证、法律程序或后台系统，他只能提出异常点并推动懂的人去查。",
    "不要让何小满像开外挂一样几分钟内拿出全部真相，日志分析应有筛选、比对和不确定性。",
    "不要把郑维写成低级失误型反派，他的绕监控、借第三方通道、提前清痕都应体现其专业与老练。",
    "不要把问题归因为纯黑客攻击或纯阴谋，公司原本系统和管理流程本就有漏洞，内鬼只是借漏洞做事。",
    "不要出现非法破解、夸张监听、神秘高手帮忙等不符合现实气质的桥段。",
    "不要让苏蔓失去既有定位，她应是把陆川的人话逻辑翻译成制度与程序，而不是变成全能侦探。",
    "不要弱化一线逻辑，本章虽然偏调查，但落脚点仍要回到站点、商户、运力为什么会被精准打击。",
    "不要让董事会在本章就正式摊牌或公开处置郑维，第17章功能应是反推成链和准备反击，不是终局揭牌。",
    "不要吃书，陆川调查内鬼的动机仍应是保站点、保骑手收益、保履约，不是突然迷恋权斗。",
    "不要让结尾钩子与前文脱节，核心站长被约谈必须建立在本章调查显示对方正在加速挖人和转移资源的前提上。"
  ],
  "emotion_curve": [
    "压抑警惕：知道有人在公司里动手，但没有证据，稍不留神就会再被甩锅。",
    "谨慎推进：在苏蔓提醒下收住莽劲，开始按规则摸线索，气氛紧绷。",
    "抽丝剥茧：陆川用业务直觉指出不正常节点，何小满顺着日志和权限往下挖，发现线索开始互相咬合。",
    "短暂兴奋：关键异常来源浮出水面，外部公关公司与内部操作有了连接，三人都意识到不是自己多心。",
    "冷静回落：苏蔓指出现在仍只是初步链条，证据还不能乱用，稍有失误就会被对方反咬。",
    "主动发力：陆川决定不再等对方出招，而是准备布网抓下一次动作，情绪从防守转为反攻。",
    "骤然收紧：老周传来站长被秘密约谈的消息，刚建立的主动感立刻变成与时间赛跑的危机感。"
  ],
  "cliffhanger": "老周深夜来电，语气发沉地告诉陆川：郑维今晚正在分头约几个核心站长，条件已经开到明面上，打算让他们明早一起宣布转投闪奔到家；如果这批人同时走，陆川刚拼出来的证据还没上桌，履约盘子就会先被抽空。",
  "next_chapter_bridge": "下一章直接承接这通电话展开，陆川必须一边压住站长阵脚、一边利用本章摸出的第三方通道和合规取证方案实施现场反制，争取在郑维正式带人倒向对手前抓到更硬的现行证据，并把调查线与站点保卫战并轨推进。"
}