{
  "chapter_index": 10,
  "chapter_title": "热搜比单量跑得更快",
  "opening_state": "陆川刚靠站点止血拿到一点基层信任，但局面远没稳住；外部短视频平台突然出现经过剪辑的现场素材，把他塑造成穿工服作秀、蹭董事长身份博眼球的笑柄。商户担心公司真要垮，骑手担心继续干会被拖欠或背锅，董事会内部则有人顺势主张收紧信息、统一公关话术，把现实问题包装过去。",
  "ending_state": "陆川没有按韩啸的思路只做表面灭火，而是用一轮可验证的履约恢复结果稳住部分商户和骑手，让少数董事第一次承认他不只是会冲现场；与此同时，陆川确认舆情不是偶然发酵，苏蔓开始从流程和权限侧追查素材来源，何小满则拿出异常后台日志，正式把矛头指向内部越权操作与持续泄密。",
  "protagonist_goal": "在舆情攻击和内部动摇同时爆发的情况下，先稳住商户、骑手与董事会对公司还能正常履约的最低信心，证明自己不是只会干活的救火队，而是能扛住第一轮系统性攻击的人。",
  "obstacle": "外部舆情传播节奏异常精准，放大了陆川身份错位的笑点；商户和骑手本就信心脆弱，极易被带节奏；韩啸试图把处理方向引向封口、控话术和切断一线发声，等于继续掩盖真实问题；陆川自己又不擅长高层公关表达，容易在镜头和正式场合吃亏。",
  "required_information": [
    "短视频舆情的核心内容必须具体：不是笼统黑稿，而是截取陆川在站点、仓库或商户现场的片段，断章取义成“外行董事长作秀翻车”。",
    "舆情冲击必须落到业务后果：商户暂停单量、骑手观望接单、站长担心被继续甩锅，而不是只有网上骂声。",
    "韩啸必须提出一套看似专业、实则偏甩锅和遮掩的方案，例如统一口径、限制现场拍摄、暂时封闭站点信息出口，以体现他与陆川路线冲突。",
    "陆川必须明确表达核心判断：热搜压不住根问题，真正能翻舆情的是把单送到、把赔付稳住、把商户电话接起来。",
    "本章要出现陆川用具体动作反压舆情的执行路径，例如临时盯关键商户、优先保障高投诉线路、公开给出真实履约数据、让站点拿结果说话。",
    "苏蔓的作用要落地：她不是单纯安慰或站台，而是从法务、内控、流程权限角度意识到素材外流和行踪泄露可能涉及内部问题，并主动介入追查。",
    "董事会态度要有微妙变化：大多数人仍把陆川当挡火墙，但至少有少数人因他顶住压力并拿到结果，开始认为他未必只是笑话。",
    "必须埋下并强化信息外泄伏笔：舆情发布时间、素材角度、传播节点与站点混乱、陆川行踪高度吻合，显示不是普通路人偶遇。",
    "何小满在结尾必须拿出后台日志，并明确指出高峰前后存在多次越权修改调度参数的异常，为下一章转入系统线提供硬证据入口。",
    "本章要延续第7到10章的阶段目标：站点止血取得阶段性成果，但危机从单纯现场失控升级为舆情与系统层面的复合攻击。"
  ],
  "avoid_conflicts": [
    "不能把陆川写成突然擅长公关操盘或媒体战争专家，他仍应更信结果与现场，公关和流程判断需要苏蔓补位。",
    "不能让舆情靠一条声明、一个律师函或一句狠话立刻逆转，必须依赖履约改善带来的现实反馈。",
    "不能让董事会突然集体支持陆川，现阶段只能是少数人改观，大多数仍观望或继续利用他。",
    "不能把韩啸写成纯降智反派，他的封口与统一口径方案要符合常见高管危机处理逻辑，只是价值排序与陆川不同。",
    "不能让公司突然资源充足、系统瞬间修好或订单全面恢复，业务改善应是局部、艰难、可验证的止血。",
    "不能忽略骑手和商户的真实利益，他们的动摇必须来自收入、赔付、准时率和信任，而不是单纯被剧情推动。",
    "不能过早实锤内鬼身份，本章只能强化疑点和异常，不直接揭露幕后具体是谁。",
    "不能吃书，陆川处理问题的出发点仍应是送达率、赔付、兄弟收益和公平，不应变成单纯保自己面子。",
    "不能将创始人、资本线或事故悬念突然展开过多，本章主轴是舆情与信息泄露，不偏离章节功能。",
    "不能把技术问题写成玄乎黑箱，何小满给出的后台日志要通俗可懂，体现参数被人动过而非神秘黑客入侵。"
  ],
  "emotion_curve": [
    "刚有起色却被热搜迎头砸下来的窝火",
    "面对全网嘲讽、商户质疑和董事会冷眼的憋闷",
    "与韩啸路线冲突时的顶火和硬拧",
    "回到业务现场后靠具体动作重新抓住节奏的专注",
    "局部数据回升、商户态度松动后的硬气反压",
    "发现传播过于精准后的警觉升级",
    "结尾看到越权日志时由稳住局面转入更深危机的冷意"
  ],
  "cliffhanger": "何小满调出后台日志，指出在站点最乱、舆情刚起的几个关键高峰时段，调度系统有人绕过正常权限多次修改参数；这意味着站点混乱和热搜发酵背后，可能一直有人在内部精准配合。",
  "next_chapter_bridge": "下一章直接承接异常日志展开：陆川、苏蔓、何小满从技术权限、流程审批和现场异常三条线并行追查，表面是查系统参数，实则开始摸到内部泄密与人为制造混乱的真正入口。"
}