{
  "chapter_index": 6,
  "chapter_title": "站点炸了，没人肯再赔",
  "opening_state": "陆川刚完成对总部汇报与现场现实不一致的首次确认，表面上还是临时董事长，实际既没有基层信任，也没有高层真正支持；公司核心站点因罚款、赔付、错派单和乱调度积怨爆发，停单情绪已经逼近临界点。",
  "ending_state": "陆川明确意识到公司最大的火不是会议室里的口径，而是一线对规则彻底失去信任；他没有用董事长身份压人，而是当众表态亲自跟单、现场核赔付账，暂时压住冲突升级，并把‘站点止血’正式变成接下来主线。",
  "protagonist_goal": "先稳住核心站点，不让骑手当晚集体停单，同时弄清楚赔付失控和乱派单的真实链条，证明自己不是来替总部继续压榨一线的。",
  "obstacle": "老周和骑手们默认总部所有人都是来甩锅的，对陆川的董事长身份天然敌视；总部过去长期把超时、错派、投诉成本层层下压，导致基层不再相信任何口头承诺；调度和运营规则又确实混乱，陆川即使想解决，也无法靠一句话立刻止损。",
  "required_information": [
    "必须明确核心站点已经处于随时停摆的边缘，危机具象到骑手拒接单、站长拍桌、商户催货。",
    "必须揭示站点爆炸的真正引爆点不是单量大本身，而是赔付规则混乱：超时、错派、无效调度造成的损失最终压给骑手和站点。",
    "必须让老周正面登场，并且不是立刻站队，而是代表基层把话说透：总部一直拿一线填报表窟窿。",
    "必须体现陆川被当成‘穿了董事长皮的总部人’，让他切身感受到身份反噬。",
    "必须出现至少一个具体现场细节来证明系统和流程脱离现实，例如跨区错派、逆路线派单、超时后重复甩责。",
    "必须把总部与基层的矛盾彻底摆上台面，让读者清楚后续主线要从会议室转向站点和人心。",
    "必须让陆川的判断升级：救公司先得救一线信心，先把赔付账和送达逻辑讲明白。",
    "必须保留轻喜剧反差感，例如陆川这个董事长到了站点比高管更像来干活的，但喜剧不能削弱基层困境的重量。",
    "必须以行动型承诺收尾，而不是空口承诺；他要提出亲自跟单、现场算账或连夜看实际派单账。"
  ],
  "avoid_conflicts": [
    "不能把站点危机写成单纯有人煽动，根因必须仍是长期规则失真和管理脱离现场。",
    "不能让陆川靠董事长头衔一开口就镇住全场，基层对他应当先质疑、顶撞、甚至不留情面。",
    "不能让老周过早变成无条件盟友，本章应是从看笑话转为正面对抗，不是直接归顺。",
    "不能让问题被一句‘取消罚款’就解决，赔付、错派、履约压力必须呈现为系统性问题。",
    "不能让高管集体弱智，哪怕他们甩锅，也要体现他们有自己的口径和自保逻辑。",
    "不能让陆川突然精通后台财务或制度细则，他的优势应是现场判断和人心识别。",
    "不能偏离前6章功能，本章重点是把冲突推进到基层并立起站点止血主线，不要提前解决大规模系统修复。",
    "不能把一线角色写成单纯吵闹工具，他们每个人愤怒都应对应真实损失与现实处境。"
  ],
  "emotion_curve": [
    "带着刚识破总部假口径后的急迫赶往站点",
    "进入现场后遭遇冷脸与火气，荒诞感迅速转为压迫感",
    "被老周和骑手当面质问，陆川感到憋屈和被误解",
    "随着具体赔付账、错派单细节被摊开，情绪从憋屈转为刺痛和愤怒",
    "陆川不再争辩身份，而是开始真正站到一线视角说话，情绪转向沉下来的认真",
    "在双方仍高度不信任的情况下做出行动承诺，形成短暂稳住局面的硬拐点",
    "结尾留在绷紧状态：今晚能不能送下去，将决定他到底是人话董事长还是另一个甩锅的总部人"
  ],
  "cliffhanger": "陆川当众摘下董事长工牌，扔到站点桌上，说今晚单子他跟着一起送，哪笔赔付该谁扛，就在现场一笔一笔算清楚。",
  "next_chapter_bridge": "下一章直接承接当夜跟单与站点实战，陆川将在真实配送链路里验证错派、超时和赔付问题，借一次现场救火争取老周和部分骑手的初步松动。"
}