{
  "chapter_index": 14,
  "chapter_title": "名单是怎么漏出去的",
  "opening_state": "陆川刚凭“先保送达、再修系统”的思路在局部稳住履约，表面上公司比前几章顺了一口气，但商户流失、异常赔付和站点出问题的节奏过于精准，明显不像单纯管理失真。苏蔓已不再只是旁观和翻译规则的人，而是开始主动配合陆川查权限、看流程、补证据；何小满也愿意冒风险，从调度和后台日志角度协助排查。陆川意识到，眼前的问题不只是送达，而是有人比他们更早知道哪里会出事。",
  "ending_state": "陆川、苏蔓和何小满虽然还没有拿到能一锤定音的直接证据，但已经把郑维负责区域与商户名单外泄、站点流失、异常赔付三条线初步绑定起来，并确认关键权限与信息流存在绕开常规审批的痕迹。陆川第一次真正接受“光靠现场抓人不够，必须靠制度和证据链把人钉住”的现实。与此同时，郑维察觉到自己可能暴露，开始反制；章节结尾处，董事会突然发出临时会议通知，议题直指评估陆川任期内的失控风险与是否提前解除其临时职务。",
  "protagonist_goal": "查清商户名单究竟是通过什么路径泄露出去的，把异常赔付和站点问题从‘巧合’推进到‘有人利用公司内部权限做局’，尽量在不惊动对方的前提下拼出可用证据链。",
  "obstacle": "对手熟悉公司流程，故意把痕迹切碎到不同系统、不同审批环节和不同责任人口中；很多关键权限曾被临时开放、借用账号或口头授权覆盖，导致表面流程合规、实则责任模糊。陆川本人不擅长取证和制度打法，容易本能地想正面质问；同时内部仍有人把他当临时背锅位，不愿给他完整权限，查得越深，越容易触碰高层利益并遭到反制。",
  "required_information": [
    "必须明确本章追查的不是抽象‘有内鬼’，而是具体的商户名单外泄、异常赔付流向和站点出问题节奏之间的关联。",
    "必须出现苏蔓主动站到陆川一边，利用法务或董事会秘书的规则意识，提醒他证据链、权限来源、审批留痕的重要性，完成其从观察者到行动盟友的状态推进。",
    "必须出现何小满从技术/调度侧提供有效信息，例如后台访问记录异常、导出痕迹、权限临时放开、回退记录缺失或系统外传递的问题，让‘系统被人利用’而非‘系统自己作妖’更清楚。",
    "必须揭示郑维负责的区域与三类异常高度重合：站点流失更集中、商户外泄更明显、赔付异常更频繁，而且每次都像提前知道会出问题。",
    "必须写出证据难拿的现实感：不能一查日志就真相大白，而是只能得到零碎片段、相互印证的侧证、可疑但不足以当场掀桌的线索。",
    "必须让陆川在本章中学习并接受一个新规则：现场判断能锁方向，但要扳倒核心利益层，必须让怀疑变成可落地的证据。",
    "必须体现郑维已经感觉到压力，至少通过态度变化、试探、删改痕迹、提前放风或推动别的议题来表现他准备先下手为强。",
    "必须埋出董事会临时会议不是偶然，而是有人把查内鬼的压力反向转成‘陆川任期内风险失控’的政治攻击，为下一章正面对抗做准备。"
  ],
  "avoid_conflicts": [
    "不要让陆川突然变成精通审计、法务、数据取证的全能型董事长；他的推进应来自现场嗅觉加苏蔓、何小满补位。",
    "不要让证据获取过于轻松，不能一台电脑、一份文件就直接锁死郑维，否则会削弱后续第15到17章的内外夹击升级空间。",
    "不要把问题全写成纯阴谋，必须保留公司原本流程混乱、权限滥开、管理失真本身就给内鬼提供土壤的现实逻辑。",
    "不要让郑维直接当场露馅或自爆，他应表现为老练、谨慎、懂流程，符合‘熟悉内部规则的高管型阻力’设定。",
    "不要忽略轻喜剧与反差感，即使在查证据的压抑段落里，也应保留陆川对高层黑话、权限迷宫和形式主义的接地气吐槽。",
    "不要让苏蔓的转变显得突兀，她应是基于前面观察后的判断，逐步从程序协助走向实质站队。",
    "不要出现创始人突然出面、神秘文件直接落地、资本方忽然反转支持等外挂式推进。",
    "不要吃掉主角核心价值观，查名单外泄的动机必须仍然落在商户信任、站点生死、骑手收益和公平规则上，而不是单纯权斗。"
  ],
  "emotion_curve": [
    "警觉：局面刚稳一点，陆川却察觉问题不像表面那么简单。",
    "拧紧：三人开始对账、查权限、翻记录，越查越觉得有人提前知道爆点。",
    "短促兴奋：零碎线索开始互相咬合，郑维的区域重合度异常，怀疑第一次有了具体指向。",
    "受挫压抑：关键证据总差半步，流程像迷宫一样把责任切碎，想抓人却抓不住。",
    "冷下来后的清醒：陆川意识到不能只靠脾气和直觉，必须学会按制度攒证据。",
    "危险逼近：郑维似乎已经闻到风声，查证行动从主动摸排变成可能被反咬。",
    "骤然下坠：董事会临时会议通知砸下，调查还没落槌，陆川先要面对自己的位置保不保得住。"
  ],
  "cliffhanger": "就在陆川准备继续顺着权限异常往下追时，苏蔓收到董事会临时会议通知：议题不是追查名单外泄，而是评估陆川上任以来的管理失控风险，并讨论是否提前解除其临时董事长职务。陆川这才意识到，对方已经先出手了。",
  "next_chapter_bridge": "下一章可直接衔接临时董事会攻防：陆川一边要应付韩啸等人把所有风险往他头上扣，一边要在会议前有限时间内整理现有侧证、争取程序空间，避免自己在拿到关键证据前先被踢出局。"
}