{
  "chapter_index": 1,
  "chapter_title": "送错的会议室",
  "opening_state": "林舟是江城同城快递员，正在恒远集团总部配送一份需要本人签收的急件。恒远集团董事会正因物流系统崩盘争执。",
  "ending_state": "林舟被董事会和董事长办公室注意，沈听澜发现老董事长早就知道林舟，身份误会正式形成。",
  "protagonist_goal": "找到收件人签收，尽快离开恒远集团去送下一单。",
  "obstacle": "会议室门牌临时更换，林舟误入董事会；董事们把他当成老董事长安排的神秘人物。",
  "required_information": [
    "恒远集团物流系统出现严重问题",
    "林舟熟悉配送一线，能看出高层报表里的不合理之处",
    "沈听澜是董事长办公室特别助理",
    "程万山正在推动董事会按他的方案接管物流资产"
  ],
  "avoid_conflicts": [
    "林舟不能主动装董事长",
    "林舟不能一章内解决集团危机",
    "董事会不能全员降智，只能因为老董事长安排和现场误会产生判断偏差"
  ],
  "emotion_curve": ["赶时间的焦躁", "误入会议的尴尬", "被质问的茫然", "说出真问题后的安静", "身份被点破的悬念"],
  "cliffhanger": "董事长秘书当众喊出林舟的名字，并说老董事长等他很久了。",
  "next_chapter_bridge": "第 2 章从林舟被迫留下解释三句话开始，进入第一次业务判断打脸。"
}

