{
  "chapter_index": 16,
  "chapter_title": "锅已经扣下来，人得先救出来",
  "opening_state": "事故舆情全面发酵，陆川被董事会和外部舆论同时推上风口浪尖，解释会在即；老周等基层也承压，但事故片区的骑手、站点和商户正在被超时、投诉、扣罚和网暴连续冲击。陆川处于最容易选择自保的一刻。",
  "ending_state": "陆川没有留在会议室做被动解释，而是先去事故现场稳运力、减赔付、安抚商户和骑手，实际把局面从失控边缘拉回一线可运转状态；他也由此确认异常不是单纯管理失误，而是有人针对郑维辖区动了调度权限。苏蔓被他的选择打动，决定冒程序风险协助深挖权限记录；一线对陆川的信任明显上升。",
  "protagonist_goal": "在自己即将被正式问责的情况下，先把事故区域的人和单子救出来，稳住骑手与商户，弄清事故究竟是自然崩盘还是人为做局，并用行动证明自己不是拿基层挡枪的董事长。",
  "obstacle": "外部舆论持续扩大，把事故定性为陆川改革翻车；董事会要求他立刻交代并有意把责任压实到他头上；老周出于保护心态劝他优先保位置；事故片区骑手士气低落、系统派单混乱、商户信任崩塌，现场止血难度极高；更关键的是，异常权限调整藏在技术和流程深处，陆川不能靠拍脑袋指认内鬼。",
  "required_information": [
    "必须明确本章事故不是单一公关危机，而是履约系统和现场秩序同时出问题，骑手与商户正在承受真实损失。",
    "必须写出陆川面临一个清晰选择：留在总部解释自保，或去现场先救人救单；并且他主动选择后者。",
    "必须体现老周劝陆川先保位置，这个劝告合理且出于情义，不是故意唱反调。",
    "必须体现苏蔓起初更关注程序与问责风险，但在看到陆川的选择后态度进一步转向支持。",
    "必须有具体现场动作，例如临时改派、人工调度、拆分异常线路、安抚商户、减轻骑手扣罚压力、先保核心时段送达等，体现主角靠执行而非嘴炮解决问题。",
    "必须交代事故前数小时调度权限曾被异常调整，而且只集中发生在郑维管辖片区，这一发现要作为关键新线索抛出。",
    "必须让何小满参与到技术排查中，说明系统不是凭空坏掉，而是有人在关键时段动过手脚或参数。",
    "必须表现一线对陆川认同的提升，原因是他在最危险的时候没有躲在总部甩锅，而是亲自下场扛。",
    "必须让陆川的内心状态出现转折：不再想着怎么脱身，而是第一次更像主动掌舵者，哪怕嘴上未必承认。",
    "必须为下一章埋下更实质的调查推进：更深层权限记录、删除日志、外部连接痕迹都开始浮现。"
  ],
  "avoid_conflicts": [
    "不能把陆川写成突然精通复杂技术取证，他只能提出异常判断，具体日志和权限排查要依赖何小满与苏蔓配合。",
    "不能让董事会全员降智或立刻服软，他们此时应继续怀疑、施压、准备甩锅，符合既有权力结构。",
    "不能让现场危机被一句话或一个电话轻松解决，必须通过多点协调、优先级取舍和具体执行逐步止血。",
    "不能让老周无条件站队成工具人，他可以支持陆川，但仍应保持老站长的现实判断和风险意识。",
    "不能把事故完全写成纯阴谋，依然要保留公司原本管理失真、系统脆弱、流程脱离现场的基础问题。",
    "不能让陆川突然变成会做高层公关包装的人，他的强项依旧是现场判断、成本意识和人心稳定。",
    "不能提前坐实郑维罪证，本章只能推进到高度可疑和线索浮现，证据链还未完整。",
    "不能让苏蔓无代价越权，她决定帮忙应带有明确程序风险和职业顾虑，这样后续合作更扎实。",
    "不能偏离轻喜剧现实感，紧张局面中可以有会议室与现场认知错位的讽刺，但不能消解一线受压的真实重量。",
    "不能吃书，陆川的决策核心仍应围绕送达率、赔付、骑手收益、公平规则，而不是单纯保董事长面子。"
  ],
  "emotion_curve": [
    "开场重压：全网骂声、董事会追责、局势像是已经判了陆川死刑。",
    "短暂犹疑：老周劝他先保住位置，现实上这也是最稳妥的路。",
    "价值观触发：陆川看到事故片区骑手和站点被双重碾压，情绪从憋屈转成火气。",
    "逆向决定：他放弃先去会议室自辩，改为先去现场救人救单，情绪完成第一次主动转向。",
    "执行拉扯：现场混乱、商户发火、骑手不信、系统添乱，过程艰难但逐步见效。",
    "局部回稳：一线开始配合，商户情绪缓下来，骑手发现陆川真在替他们扛事。",
    "冷静生疑：随着何小满排查数据，陆川意识到这不像普通事故，更像冲着他来的样板翻车。",
    "结尾上拱：绝望感被倔强替代，陆川真正有了掌舵者气质，同时新的内鬼线索把危机抬到更高层级。"
  ],
  "cliffhanger": "何小满在备份层里找到一段本该被清掉的操作日志，显示事故前关键时段有人通过异常外部连接介入了郑维片区的调度权限，而这段记录一旦坐实，就不只是系统失误，而是内外勾连的证据开端。",
  "next_chapter_bridge": "下一章可直接承接深夜技术排查与证据保全过程：苏蔓负责顶住程序风险与总部压力，陆川一边继续稳住事故片区，一边顺着异常权限、删除日志和郑维辖区的时间线去反推操作者，正式从救火转入抓内鬼。"
}