{
  "chapter_index": 12,
  "chapter_title": "谁都说为大局，赔钱的是底下人",
  "opening_state": "站点履约在陆川前期救火后出现短暂回升，但基层情绪并未真正稳住。老周等站长发现，系统里的旧赔付规则、超时罚则、错派成本和考核口径仍在持续吞掉站点利润，骑手和站点都觉得自己只是被拉来补窟窿。总部会议层面却倾向把问题继续定义为‘执行力不足’和‘特殊时期先顾大盘数据’。陆川已经意识到，单靠现场硬扛不能长期救公司，必须开始碰制度。",
  "ending_state": "陆川顶住韩啸和财务报表压力，推动试行‘异常单责任拆分’与‘站点申诉直通机制’，并明确先在老周站点试点。老周首次公开表态支持陆川，愿意拿自己站点做样板。董事会内部也出现不再一边倒否定陆川的观望派，默认他可以先试。但新规则刚落地，外部竞争者立刻对老周站点发起高价挖角，说明陆川动到的不是表层流程，而是真正利益。",
  "protagonist_goal": "把站点与骑手最憋屈、最伤收益的赔付和考核问题掰开讲清，并争取到一个可落地的局部规则试点，证明公司不能只修时效，还得修责任分配和利益分配。",
  "obstacle": "韩啸以‘大局稳定’和‘财务不能更难看’为由反对动制度，试图继续把所有损耗压给站点；中层惯性思维把复杂异常单统一甩给末端；一线虽然支持陆川，但也担心试点只是一阵风，最后反而让敢出头的人先吃亏。陆川还缺乏完整制度话语，需要用现场案例、赔付逻辑和苏蔓的制度翻译能力，把情绪诉求变成可执行方案。",
  "required_information": [
    "必须明确展示：履约率回升不等于问题解决，旧赔付与旧考核仍在制造基层流失。",
    "必须具体化赔付问题，例如超时并非都由骑手或站点造成，错派、商户出餐慢、系统异常、客服滞后都可能导致损失被末端单方面承担。",
    "必须揭示：一些被总部认定为‘站点管理差’的区域，实际是被不合理罚则和错派成本拖垮，而非纯粹执行无能。",
    "必须让陆川看到并说出核心逻辑：不能谁都喊大局，最后赔钱的永远是底下人。",
    "必须安排老周拿出一线真实账本或具体案例，让抽象制度问题变得可感、可算、可争辩。",
    "必须让苏蔓发挥作用，把陆川的人话主张整理成能在公司内部推动的试点机制或会议表述。",
    "必须出现韩啸的现实性反对：不是单纯坏，而是强调财务报表、风险暴露和制度一动全身的代价。",
    "必须推动陆川从临时救火思维转向局部立规矩，形成阶段性成长。",
    "必须落地本章试点内容：异常单责任拆分、站点申诉直通机制，且说明只是试行，不是全公司一刀切。",
    "必须埋出董事会态度变化：有人仍想甩锅，有人开始觉得陆川的方法值得先看结果。",
    "必须在结尾引出外部竞争者的即时反应，说明新规则触动了运力和站点稳定的核心利益。"
  ],
  "avoid_conflicts": [
    "不要把制度调整写成陆川一句话就全公司通过，必须体现阻力、讨论和试点范围有限。",
    "不要让陆川突然精通财务、法务或复杂制度设计，他应主要负责指出问题、抓住逻辑，制度化表达需由苏蔓补位。",
    "不要把韩啸写成无脑反派，他的反对要符合管理层对报表、风险和责任口径的真实考虑。",
    "不要让一线角色只会喊冤，老周和站点方应提供有细节的损失案例、真实顾虑和现实判断。",
    "不要否定前几章止血成果，本章重点是说明止血不等于治本，而不是前面全白干。",
    "不要引入凭空资金补贴或神来之笔式奖励方案，规则修正应建立在责任划分和流程修补上。",
    "不要把问题全归结为阴谋，根基仍是制度失真、调度错配和管理甩锅结构。",
    "不要让董事会突然全面倒向陆川，只能出现有限度的观望与试探性支持。",
    "不要弱化主角核心价值观，陆川推动规则调整的出发点必须仍是送达率、公平赔付、兄弟收益和长期稳定。",
    "不要提前过重展开内鬼线，本章重点是规则与人心，不抢后续更大冲突。"
  ],
  "emotion_curve": [
    "开场稳中带虚：表面数据好转，但基层情绪依旧发闷，读者感到问题没过去。",
    "中段积累憋屈：通过站点账、异常单案例和老周的火气，把‘谁都讲大局，赔钱的是底下人’的委屈顶起来。",
    "会议对撞：陆川与韩啸围绕制度是否该动发生正面冲突，情绪从憋屈转为硬顶。",
    "找到抓手：在苏蔓协助下，陆川把怒气变成具体试点方案，情绪转为清醒和决意。",
    "局部胜利：老周公开支持、试点获得放行，带来一次不靠嘴赢而靠规则推进的爽感。",
    "结尾再绷紧：新规刚推就遭遇闪奔到家挖角，形成‘刚立住一块地盘，外敌就扑上来’的危机感。"
  ],
  "cliffhanger": "老周刚在站点群里公开支持试点，闪奔到家的人就带着更高单价和保底条件堵到站点门口，当场挖骑手、挖调度，像是早就盯着这里等规则一动。",
  "next_chapter_bridge": "下一章直接承接老周站点被挖角危机，检验陆川新规则能否真正稳住人心，也让他意识到内部规则一修，外部竞争就会立刻放大攻势，局面从内部整顿升级为内外夹击。"
}