{
  "chapter_index": 20,
  "chapter_title": "这公司，我先不让它倒",
  "opening_state": "内鬼线已被当众拆穿或基本坐实，迅城达最危险的舆情雪崩点暂时止住，但市场信心还没真正回来。核心商户仍在观望，站点和骑手虽然出了一口恶气，却都在等总部下一步到底是继续修，还是换个说法继续甩锅。董事会表面沉默，实际是在等陆川拿出一套不靠喊口号、能马上执行的稳盘方案。陆川连续救火后身心疲惫，也第一次必须正面回答：他到底只是临时顶锅，还是决定继续坐这个位置。",
  "ending_state": "赵姐代表核心商户同意给出续合作观察期，老周和多名站长明确公开站队，董事会在现实结果面前默认陆川继续掌舵，韩啸被迫收缩权力。陆川不再嘴硬说自己只想脱身，而是主动表态先把公司送回正轨，完成从被迫上位到主动留下的阶段转变。同时，苏蔓在卷尾拿出程振山留下的第二层文件，把公司更深层的路线之争正式抛到台前。",
  "protagonist_goal": "在最短时间内用真实可执行的动作稳住核心商户、稳住站点与骑手信心、压住董事会继续甩锅或拆卖的冲动，并给出一个自己愿意继续留下负责的明确态度。",
  "obstacle": "外部市场不会因为内鬼被揪出就自动恢复信任，商户只认今天能不能准时送到；站点长期被伤过，不会轻易再信总部；董事会尤其是韩啸和资本止损派更看重风险隔离与责任归属，未必愿意给陆川真正权力。更大的阻碍来自陆川本人，他抗拒权力已久，嘴上一直把董事长位置当烫手山芋，这一章必须让他完成心理上的主动接盘。",
  "required_information": [
    "必须交代内鬼事件的后续影响：虽然真相已出，但市场信任恢复远比抓人慢，危机并未自动结束。",
    "必须出现核心商户侧的现实态度，最好通过赵姐表达：不听战略，不吃情怀，只看履约、赔付和响应速度，因此她给的是观察期，不是无条件支持。",
    "必须出现站点和骑手侧的反馈，体现他们不是被煽动的工具，而是在看规则会不会真的改、公平会不会真的落地。",
    "必须让老周和若干站长公开表态继续跟陆川干，这代表基层信任被重新建立，是陆川坐实位置的重要一环。",
    "必须呈现陆川给董事会的方案不是宏大叙事，而是分轻重缓急的止血动作，例如先保核心商户、先稳高密度站点、先控赔付口径、先恢复客服与调度响应。",
    "必须体现苏蔓的制度翻译作用：把陆川的人话和现场逻辑转成董事会能接受的表达，帮助他合法、程序化地站稳。",
    "必须自然揭示关键真相：程振山当初指定陆川，不是病急乱投医，而是此前在一次区域爆单事故里见过陆川处理混乱的能力——先救履约、再稳人心、最后算成本。",
    "必须让这个揭示服务于人物升格，不是突然煽情认亲，而是解释陆川为何具备被选中的资格，也回应前期“为什么偏偏是他”的伏笔。",
    "必须写出董事会态度变化：不是集体感动，而是在现实结果面前不得不承认陆川有实际掌舵能力。",
    "必须保留韩啸的现实性：他可以暂时收缩、沉默、转为技术性服软，但不能突然降智或彻底认输。",
    "必须有陆川主动选择留下的明确表达，语气应符合人物——不是霸总宣言，而是带着疲惫、责任感和一线习气的朴素承诺，比如‘这公司，我先不让它倒’。",
    "必须在章尾抛出第二层文件，明确里面不只是授权，还涉及公司原始路线之争的名单，为下一阶段主线升级做准备。"
  ],
  "avoid_conflicts": [
    "不要把危机收束写成一句话翻盘，核心商户的回归只能是观察期和有限恢复，不能一夜满血。",
    "不要让陆川突然变得像天生董事长，他的表达仍应接地气、嫌废话、重执行。",
    "不要让董事会成员集体降智或集体真心臣服，他们是基于利益和结果暂时承认陆川。",
    "不要让韩啸当场彻底出局，如果前文没有完成法律或组织程序，就应保持其权力被压缩而非瞬间消失。",
    "不要把程振山指定陆川写成血缘、神秘背景或夸张伯乐神话，必须仍建立在现实观察和业务判断上。",
    "不要让苏蔓替代主角完成核心决策，她负责制度与信息支撑，真正拍板和承担的人仍是陆川。",
    "不要忽略一线的真实利益，站长和骑手支持陆川必须基于规则改善、收益公平和少背黑锅，而不是空喊义气。",
    "不要把资本止损派写成纯反派，他们可以继续保留拆卖、止损的逻辑，只是这一章被现实数据压住。",
    "不要吃掉前文价值观，陆川的判断核心仍是送达率、赔付、兄弟收益、公平规则，而不是突然追求权位本身。",
    "不要把卷尾第二层文件一次性讲透，应该只揭开更大冲突的门缝，保留后续推进空间。"
  ],
  "emotion_curve": [
    "开场余震与疲惫：危机刚止血，但没人真正松气，陆川处在连轴转后的沉沉疲惫里。",
    "中段克制对峙：面对商户、站点、董事会三方压力，陆川不再只靠硬怼，而是用结果和次序逐步稳局。",
    "局部回暖：赵姐给观察期、老周等人公开站队，一线和市场开始给出有限但真实的回应。",
    "认可落地后的沉静：董事会默认陆川继续掌舵，不是热血高潮，而是一种被现实逼出来的承认。",
    "人物升格：程振山当年为什么选他被揭开，陆川第一次真正理解自己不是误闯，而是确实适合做这件事。",
    "结尾定心与再起悬念：陆川主动说出留下，情绪完成阶段收束；紧接着第二层文件出现，把读者从收束感重新拉向更大的下一轮冲突。"
  ],
  "cliffhanger": "苏蔓在收尾时拿出程振山留下的第二层文件，点明这不只是临时授权的补充，里面还有一份牵涉公司原始路线之争的名单；说明内鬼事件只是表层，真正决定迅城达到底变成什么样的旧账，现在才要翻开。",
  "next_chapter_bridge": "下一章可直接承接苏蔓展示第二层文件后的夜谈或临时闭门会：陆川刚决定留下，就被迫面对公司更早期的路线分裂、被隐藏的人事与利益链条，以及程振山真正想让他改的，不只是几场危机，而是整家公司跑偏的方向。"
}