{
  "chapter_index": 9,
  "chapter_title": "先救午高峰，再谈明天",
  "opening_state": "核心站点刚经历连续混乱，午高峰前订单已经明显上涨，周边还有竞争对手趁乱高价挖骑手。陆川虽然靠前几次现场处置赢来一点基层信任，但总部资源没有真正松动，站点人手紧、骑手心态浮、商户耐心见底，赵姐也处在随时切换合作方的边缘。陆川必须在没有新增预算兜底、没有完整高层支持的情况下，立刻拿出能扛过午高峰的办法。",
  "ending_state": "陆川用临时异常单豁免、站长有限补贴授权、人工回拨重点商户、现场重排线路与优先级等组合动作，硬把午高峰从崩盘边缘拉回。履约率和商户情绪都出现可见改善，赵姐决定暂缓切换合作，站点和骑手对陆川的信任明显提升，老周一类基层骨干开始真正把他当成能扛事的人。但局面只是止血不是治本，且在大家刚松口气时，外部舆论攻击突然冒头，新的麻烦比现场更难缠。",
  "protagonist_goal": "在不靠撒钱和空喊口号的前提下，稳住午高峰运力与时效，证明公司现在最缺的不是漂亮方案，而是有人愿意对异常单、赔付和公平规则当场认账。",
  "obstacle": "订单暴增超出预估，现有调度和站点协同已经失真；骑手担心跑得越多赔得越多，被系统反扣；站长没有权限临机处理补贴与异常；商户因连续失约准备流失；竞争对手在周边用高价和倒闭传闻挖人；总部流程慢，无法提供即时资金和决策支持。",
  "required_information": [
    "必须明确表现午高峰是具体业务战场，而不是抽象危机，要有订单、路线、骑手、商户、站点联动的现场感。",
    "必须点出骑手真正关心的不只是单价，而是规则公平、异常责任归属、系统扣罚是否合理。",
    "必须让陆川的解决方案来自一线经验和优先级判断，不是天降资源，不是一句话全员服从。",
    "必须出现陆川推出临时异常单豁免机制，核心作用是先止住骑手对系统反扣的恐惧。",
    "必须出现站长授权补贴，但要写清这是有限度、临时性的现场授权，不是随意撒钱。",
    "必须出现人工回拨商户机制，说明商户很多时候要的不是宏大战略，而是有人解释、有人认账、有人给明确时间。",
    "必须让赵姐作为商户侧真实压力代表出场，她先施压后观望，最终因为履约改善而暂缓切换合作。",
    "必须体现老周或同类基层角色对陆川态度进一步转变，形成站点内部支持度提升。",
    "必须把爽点落在实打实止血上：履约率回升、商户暂留、骑手愿意继续跑，而不是会议室里嘴仗赢了。",
    "必须埋出一个认知：系统问题和规则问题比单纯缺人更致命，为后续系统线推进做准备。",
    "必须保留轻喜剧反差，例如陆川用送单逻辑拆穿总部或流程黑话，但不能削弱现场压力。",
    "必须在章节尾部引出短视频热搜，形成从业务战转向舆论战的下一层危机。"
  ],
  "avoid_conflicts": [
    "不能把陆川写成突然精通资本、公关或高阶财务，他解决的是现场履约和规则止血。",
    "不能让问题靠额外大笔资金、神秘人脉或投资方突然支持解决。",
    "不能把竞争对手写成纯背景板，挖骑手要体现其现实压力，但不能直接抢走所有人导致前文止血失效。",
    "不能让骑手因为陆川几句热血话就无条件拼命，必须有明确规则松绑和利益保障才愿意继续跑。",
    "不能让高管全部无能化，阻力应主要来自流程滞后、权限僵化和立场不同。",
    "不能出现与前期成长线冲突的状态，陆川此时仍是被迫掌舵中的救火者，不是稳坐大位的董事长。",
    "不能让商户轻易被感动，赵姐的态度转变必须建立在实际履约改善之上。",
    "不能把系统问题在本章彻底解决，本章只做到人工兜底和临时修补，为后续技术线留空间。",
    "不能忽略公司资金紧张设定，站长补贴授权必须写成受限额度、可追溯、为止血临时放开。",
    "不能吃掉主角核心价值观，重点始终应围绕送达率、赔付、公平和一线收益。"
  ],
  "emotion_curve": [
    "午高峰将至的紧绷与压迫",
    "订单失控、运力松动带来的焦灼升级",
    "陆川看穿症结不是单价而是规则失信后的强行接管",
    "一线执行中的混乱、顶牛与见招拆招",
    "第一批单子稳住后的短暂提气",
    "履约率回升、商户松口后的实打实松气",
    "站点内部认可提升带来的扬眉吐气",
    "热搜短视频突袭造成的新一轮发冷与不安"
  ],
  "cliffhanger": "就在站点和商户都刚刚缓过一口气时，网上突然冲起一条短视频热搜：“迅城达董事长亲自送单都救不回烂系统。”视频切片明显带节奏，既嘲讽陆川作秀，也把公司问题从站点现场推到了公众视野。",
  "next_chapter_bridge": "下一章可直接承接这条热搜引发的舆论危机：苏蔓介入分析传播链路，陆川则发现视频内容对内部流程和现场情况过于熟悉，开始怀疑这不只是外部嘲讽，而是有人在公司内部配合放料。"
}