{
  "chapter_index": 7,
  "chapter_title": "董事长下场抢单",
  "opening_state": "陆川刚完成对高层汇报与一线现实不一致的第一次验证，但在公司内部仍被视为临时顶锅的人。晚高峰突发爆单，核心站点仓口拥堵、待派订单激增、骑手情绪濒临失控，老周和站点众人对总部承诺极不信任，认为再接单只会继续赔钱挨骂。陆川到场时，现场已经进入‘谁都知道要出事，但没人能拍板改规则’的状态。",
  "ending_state": "陆川没有靠身份压人，而是亲自下场跑单、现场拆区、临时并单、按顺路逻辑补缺，硬把最危险的一波晚高峰压住，证明问题核心在系统乱派和跨片区塞单，不在骑手偷懒。老周第一次真正改观，默认陆川不是来做秀的；部分骑手决定再观望一天、暂不停单。但局面只是暂时止血，头部商户赵姐已经堵到站点门口，要求马上终止合作，把危机从站内履约推向商户信任层面。",
  "protagonist_goal": "在晚高峰最危险时段稳住核心站点履约，证明一线崩盘不是骑手不干活，而是系统派单和总部规则出了问题，同时争取让骑手和站长愿意再给他一天时间。",
  "obstacle": "时间窗口极短，爆单发生在晚高峰；站点运力不足、路线被系统打乱、跨片区订单堆积、商户持续催单、用户投诉上升；骑手普遍不信总部，担心多跑多赔；陆川虽然懂现场，但刚上位不久，缺乏正式威信和完整指挥链，必须一边亲自跑一边临场协调，稍有失误就会被认定为作秀翻车。",
  "required_information": [
    "必须明确呈现晚高峰爆单的具体现场感：仓口拥堵、待派订单数字上涨、电话催单不断、骑手进出混乱。",
    "必须揭示本章关键认知：大量超时并非骑手消极怠工，而是同一骑手被系统连续塞入跨片区订单，导致路线逻辑彻底崩坏。",
    "必须让陆川的解决方式落在具体动作上，如临时拆区、按地理顺路重排、近单近送、并单补缺、优先处理最容易连锁爆炸的订单。",
    "必须写出陆川亲自下场跑单，不是喊口号，而是用身体力行换取基层信任。",
    "必须体现老周起初看笑话或不信任，过程中因陆川真懂现场而态度松动，形成关系转折。",
    "必须体现骑手群体的真实顾虑：收益、赔付、超时处罚、被骂、被系统坑，而不是单纯情绪化闹事。",
    "必须体现总部与现场语言差异，保持高层黑话与陆川人话逻辑的反差感，但本章重心在现场执行。",
    "必须让‘部分骑手愿意再观望一天’成为清晰结果，说明陆川只赢得暂时信任，不是彻底收服。",
    "必须埋下商户端压力升级：站点刚稳住，赵姐已对履约失去耐心，为下一章商户线冲突接力。"
  ],
  "avoid_conflicts": [
    "不要把陆川写成靠董事长身份一句话就让所有人听命；信任必须通过一起扛单、现场判断和结果换来。",
    "不要让问题被轻飘飘解决；只能是压住最危险时段、暂时止血，不能一章内彻底修好整个站点系统。",
    "不要把骑手写成无理取闹工具人，他们的不信任必须有现实依据，围绕赔付、收入、超时责任展开。",
    "不要让高管集体降智缺席现实；即便本章重现场，也应默认总部规则和系统设置是持续背景压力。",
    "不要让陆川突然表现出资本、法务、复杂技术全能，他的优势只能是现场判断、路线逻辑和人心协调。",
    "不要吃书，陆川核心关注点必须始终是送达率、赔付、公平和兄弟们别白赔。",
    "不要把系统问题写成纯阴谋，本章应先落在调度逻辑失真和管理脱离现场，阴谋线最多只做极轻微暗示。",
    "不要让老周在一章内直接变成死忠，只能是首次改口、开始认可。",
    "不要让商户端矛盾凭空消失，既然本章止血有限，就必须保留赵姐升级施压的后果。"
  ],
  "emotion_curve": [
    "开场压迫：晚高峰爆单，现场混乱，所有人都觉得又要炸。",
    "初段憋屈：陆川到场后发现没人信总部，自己董事长身份反而像笑话。",
    "中段狼狈：他被迫亲自抢单、跑现场、边送边看线路，处处救火。",
    "中段反打：陆川逐步看穿跨片区塞单的关键问题，用接地气方法临时重排。",
    "后段热血：骑手发现他不是作秀，开始配合，站点最危险时段被硬压住。",
    "尾声短暂松气：老周改口，部分骑手愿意再等等，陆川拿到第一波真实威信。",
    "结尾再压顶：赵姐堵门要终止合作，说明更大的信任危机才刚开始。"
  ],
  "cliffhanger": "站点内部刚从崩盘边缘被拉回来，头部商户赵姐却当场堵在门口，拿着连续超时和客诉记录，要求迅城达立刻停止合作，并质问‘你们到底还有没有人能负责今天这摊事？’",
  "next_chapter_bridge": "下一章直接承接赵姐发难，冲突从站点运力止血转向商户信任保卫。陆川需要把本章看见的履约真问题，转化成能对商户交代的解决方案与时间承诺，同时进一步验证总部系统和站点规则到底错在什么地方。"
}